arxiv_id,title,authors,submitted,categories,url,abstract
2501.03181,FaceSpeak: Expressive and High-Quality Speech Synthesis from Human Portraits of Different Styles,Tian-Hao Zhang et.al.,2025-01-02,,https://arxiv.org/abs/2501.03181,
2501.01182,RingFormer: A Neural Vocoder with Ring Attention and Convolution-Augmented Transformer,Seongho Hong et.al.,2025-01-02,,https://arxiv.org/abs/2501.01182,
2501.01102,Disambiguation of Chinese Polyphones in an End-to-End Framework with Semantic Features Extracted by Pre-trained BERT,Dongyang Dai et.al.,2025-01-02,,https://arxiv.org/abs/2501.01102,
2412.20155,Stable-TTS: Stable Speaker-Adaptive Text-to-Speech Synthesis via Prosody Prompting,Wooseok Han et.al.,2024-12-28,,https://arxiv.org/abs/2412.20155,
2412.19102,"""I've Heard of You!"": Generate Spoken Named Entity Recognition Data for Unseen Entities",Jiawei Yu et.al.,2024-12-26,,https://arxiv.org/abs/2412.19102,
2412.19043,Indonesian-English Code-Switching Speech Synthesizer Utilizing Multilingual STEN-TTS and Bert LID,Ahmad Alfani Handoyo et.al.,2024-12-26,,https://arxiv.org/abs/2412.19043,
2412.18839,Advancing NAM-to-Speech Conversion with Novel Methods and the MultiNAM Dataset,Neil Shah et.al.,2024-12-25,,https://arxiv.org/abs/2412.18839,
2412.18300,GenPod: Constructive News Framing in AI-Generated Podcasts More Effectively Reduces Negative Emotions Than Non-Constructive Framing,Wen Ku et.al.,2024-12-24,,https://arxiv.org/abs/2412.18300,
2412.16102,Interleaved Speech-Text Language Models are Simple Streaming Text to Speech Synthesizers,Yifan Yang et.al.,2024-12-23,,https://arxiv.org/abs/2412.16102,
2412.17048,Why Do Speech Language Models Fail to Generate Semantically Coherent Outputs? A Modality Evolving Perspective,Hankun Wang et.al.,2024-12-22,,https://arxiv.org/abs/2412.17048,
2412.16977,Incremental Disentanglement for Environment-Aware Zero-Shot Text-to-Speech Synthesis,Ye-Xin Lu et.al.,2024-12-22,,https://arxiv.org/abs/2412.16977,
2412.16846,Autoregressive Speech Synthesis with Next-Distribution Prediction,Xinfa Zhu et.al.,2024-12-22,,https://arxiv.org/abs/2412.16846,
2412.14890,"Scale This, Not That: Investigating Key Dataset Attributes for Efficient Speech Enhancement Scaling",Leying Zhang et.al.,2024-12-19,,https://arxiv.org/abs/2412.14890,
2412.11795,ProsodyFM: Unsupervised Phrasing and Intonation Control for Intelligible Speech Synthesis,Xiangheng He et.al.,2024-12-19,,https://arxiv.org/abs/2412.11795,
2412.13279,Synthetic Speech Classification: IEEE Signal Processing Cup 2022 challenge,Mahieyin Rahmun et.al.,2024-12-17,,https://arxiv.org/abs/2412.13279,
2412.12710,Enhancing Naturalness in LLM-Generated Utterances through Disfluency Insertion,Syed Zohaib Hassan et.al.,2024-12-17,,https://arxiv.org/abs/2412.12710,
2412.12619,Phoneme-Level Feature Discrepancies: A Key to Detecting Sophisticated Speech Deepfakes,Kuiyuan Zhang et.al.,2024-12-17,,https://arxiv.org/abs/2412.12619,
2412.12498,Hierarchical Control of Emotion Rendering in Speech Synthesis,Sho Inoue et.al.,2024-12-17,,https://arxiv.org/abs/2412.12498,
2412.11409,Multi-modal and Multi-scale Spatial Environment Understanding for Immersive Visual Text-to-Speech,Rui Liu et.al.,2024-12-17,,https://arxiv.org/abs/2412.11409,
2412.10208,Efficient Generative Modeling with Residual Vector Quantization-Based Tokens,Jaehyeon Kim et.al.,2024-12-16,,https://arxiv.org/abs/2412.10208,
2412.10103,AMuSeD: An Attentive Deep Neural Network for Multimodal Sarcasm Detection Incorporating Bi-modal Data Augmentation,Xiyuan Gao et.al.,2024-12-13,,https://arxiv.org/abs/2412.10103,
2412.08918,CSSinger: End-to-End Chunkwise Streaming Singing Voice Synthesis System Based on Conditional Variational Autoencoder,Jianwei Cui et.al.,2024-12-13,,https://arxiv.org/abs/2412.08918,
2412.06581,EmoSpeech: A Corpus of Emotionally Rich and Contextually Detailed Speech Annotations,Weizhen Bian et.al.,2024-12-12,,https://arxiv.org/abs/2412.06581,
2412.08635,Multimodal Latent Language Modeling with Next-Token Diffusion,Yutao Sun et.al.,2024-12-11,,https://arxiv.org/abs/2412.08635,
2412.08312,A Unified Model For Voice and Accent Conversion In Speech and Singing using Self-Supervised Learning and Feature Extraction,Sowmya Cheripally et.al.,2024-12-11,,https://arxiv.org/abs/2412.08312,
2412.08283,A Preliminary Analysis of Automatic Word and Syllable Prominence Detection in Non-Native Speech With Text-to-Speech Prosody Embeddings,Anindita Mondal et.al.,2024-12-11,,https://arxiv.org/abs/2412.08283,
2412.08117,LatentSpeech: Latent Diffusion for Text-To-Speech Generation,Haowei Lou et.al.,2024-12-11,,https://arxiv.org/abs/2412.08117,
2412.08112,Aligner-Guided Training Paradigm: Advancing Text-to-Speech Models with Aligner Guided Duration,Haowei Lou et.al.,2024-12-11,,https://arxiv.org/abs/2412.08112,
2412.06602,Towards Controllable Speech Synthesis in the Era of Large Language Models: A Survey,Tianxin Xie et.al.,2024-12-09,,https://arxiv.org/abs/2412.06602,
2412.03388,DiffStyleTTS: Diffusion-based Hierarchical Prosody Modeling for Text-to-Speech with Diverse and Controllable Styles,Jiaxuan Liu et.al.,2024-12-04,,https://arxiv.org/abs/2412.03388,
2412.02612,GLM-4-Voice: Towards Intelligent and Human-Like End-to-End Spoken Chatbot,Aohan Zeng et.al.,2024-12-03,,https://arxiv.org/abs/2412.02612,
2411.13314,I2TTS: Image-indicated Immersive Text-to-speech Synthesis with Spatial Perception,Jiawei Zhang et.al.,2024-12-02,,https://arxiv.org/abs/2411.13314,
2412.05315,Text Is Not All You Need: Multimodal Prompting Helps LLMs Understand Humor,Ashwin Baluja et.al.,2024-12-01,,https://arxiv.org/abs/2412.05315,
2411.18320,Continual Learning in Machine Speech Chain Using Gradient Episodic Memory,Geoffrey Tyndall et.al.,2024-11-27,,https://arxiv.org/abs/2411.18320,
2411.18138,SALMONN-omni: A Codec-free LLM for Full-duplex Speech Understanding and Generation,Wenyi Yu et.al.,2024-11-27,,https://arxiv.org/abs/2411.18138,
2411.13577,WavChat: A Survey of Spoken Dialogue Models,Shengpeng Ji et.al.,2024-11-26,,https://arxiv.org/abs/2411.13577,
2411.13159,Hard-Synth: Synthesizing Diverse Hard Samples for ASR using Zero-Shot TTS and LLM,Jiawei Yu et.al.,2024-11-20,,https://arxiv.org/abs/2411.13159,
2412.00028,A Context-Based Numerical Format Prediction for a Text-To-Speech System,Yaser Darwesh et.al.,2024-11-19,,https://arxiv.org/abs/2412.00028,
2411.12719,Rethinking MUSHRA: Addressing Modern Challenges in Text-to-Speech Evaluation,Praveen Srinivasa Varadhan et.al.,2024-11-19,,https://arxiv.org/abs/2411.12719,
2411.12619,Leveraging Virtual Reality and AI Tutoring for Language Learning: A Case Study of a Virtual Campus Environment with OpenAI GPT Integration with Unity 3D,Adithya TG et.al.,2024-11-19,,https://arxiv.org/abs/2411.12619,
2411.11258,ESTVocoder: An Excitation-Spectral-Transformed Neural Vocoder Conditioned on Mel Spectrogram,Xiao-Hang Jiang et.al.,2024-11-18,,https://arxiv.org/abs/2411.11258,
2411.07563,Improving Grapheme-to-Phoneme Conversion through In-Context Knowledge Retrieval with Large Language Models,Dongrui Han et.al.,2024-11-12,,https://arxiv.org/abs/2411.07563,
2411.06970,Enhancing Accessibility in Special Libraries: A Study on AI-Powered Assistive Technologies for Patrons with Disabilities,Snehasish Paul Shivali Chauhan et.al.,2024-11-11,,https://arxiv.org/abs/2411.06970,
2411.06540,Debatts: Zero-Shot Debating Text-to-Speech Synthesis,Yiqiao Huang et.al.,2024-11-10,,https://arxiv.org/abs/2411.06540,
2411.01156,Fish-Speech: Leveraging Large Language Models for Advanced Multilingual Text-to-Speech Synthesis,Shijia Liao et.al.,2024-11-09,,https://arxiv.org/abs/2411.01156,
2411.04671,CUIfy the XR: An Open-Source Package to Embed LLM-powered Conversational Agents in XR,Kadir Burak Buldu et.al.,2024-11-07,,https://arxiv.org/abs/2411.04671,
2411.02625,EmoSphere++: Emotion-Controllable Zero-Shot Text-to-Speech via Emotion-Adaptive Spherical Vector,Deok-Hyeon Cho et.al.,2024-11-04,,https://arxiv.org/abs/2411.02625,
2410.24019,Speech is More Than Words: Do Speech-to-Text Translation Systems Leverage Prosody?,Ioannis Tsiamas et.al.,2024-10-31,,https://arxiv.org/abs/2410.24019,
2410.23320,Lina-Speech: Gated Linear Attention is a Fast and Parameter-Efficient Learner for text-to-speech synthesis,Théodor Lemerle et.al.,2024-10-30,,https://arxiv.org/abs/2410.23320,
2410.22179,Very Attentive Tacotron: Robust and Unbounded Length Generalization in Autoregressive Transformer-Based Text-to-Speech,Eric Battenberg et.al.,2024-10-29,,https://arxiv.org/abs/2410.22179,
2410.21951,Fast and High-Quality Auto-Regressive Speech Synthesis via Speculative Decoding,Bohan Li et.al.,2024-10-29,,https://arxiv.org/abs/2410.21951,
2410.21641,RDSinger: Reference-based Diffusion Network for Singing Voice Synthesis,Kehan Sui et.al.,2024-10-29,,https://arxiv.org/abs/2410.21641,
2410.21620,Asynchronous Tool Usage for Real-Time Agents,Antonio A. Ginart et.al.,2024-10-28,,https://arxiv.org/abs/2410.21620,
2410.21502,Enhancing TTS Stability in Hebrew using Discrete Semantic Units,Ella Zeldes et.al.,2024-10-28,,https://arxiv.org/abs/2410.21502,
2410.20742,Mitigating Unauthorized Speech Synthesis for Voice Protection,Zhisheng Zhang et.al.,2024-10-28,,https://arxiv.org/abs/2410.20742,
2410.20336,Get Large Language Models Ready to Speak: A Late-fusion Approach for Speech Generation,Maohao Shen et.al.,2024-10-27,,https://arxiv.org/abs/2410.20336,
2410.19199,Making Social Platforms Accessible: Emotion-Aware Speech Generation with Integrated Text Analysis,Suparna De et.al.,2024-10-24,,https://arxiv.org/abs/2410.19199,
2410.18607,STTATTS: Unified Speech-To-Text And Text-To-Speech Model,Hawau Olamide Toyin et.al.,2024-10-24,,https://arxiv.org/abs/2410.18607,
2410.17901,ELAICHI: Enhancing Low-resource TTS by Addressing Infrequent and Low-frequency Character Bigrams,Srija Anand et.al.,2024-10-23,,https://arxiv.org/abs/2410.17901,
2410.17081,Continuous Speech Tokenizer in Text To Speech,Yixing Li et.al.,2024-10-22,,https://arxiv.org/abs/2410.17081,
2410.16726,Enhancing Low-Resource ASR through Versatile TTS: Bridging the Data Gap,Guanrou Yang et.al.,2024-10-22,,https://arxiv.org/abs/2410.16726,
2410.16048,Continuous Speech Synthesis using per-token Latent Diffusion,Arnon Turetzky et.al.,2024-10-21,,https://arxiv.org/abs/2410.16048,
2410.14197,A Unified Framework for Collecting Text-to-Speech Synthesis Datasets for 22 Indian Languages,Sujitha Sathiyamoorthy et.al.,2024-10-18,,https://arxiv.org/abs/2410.14197,
2410.14101,Multi-Source Spatial Knowledge Understanding for Immersive Visual Text-to-Speech,Shuwei He et.al.,2024-10-18,,https://arxiv.org/abs/2410.14101,
2410.13357,Enhancing Crowdsourced Audio for Text-to-Speech Models,José Giraldo et.al.,2024-10-17,,https://arxiv.org/abs/2410.13357,
2410.13342,DART: Disentanglement of Accent and Speaker Representation in Multispeaker Text-to-Speech,Jan Melechovsky et.al.,2024-10-17,,https://arxiv.org/abs/2410.13342,
2410.13288,DurIAN-E 2: Duration Informed Attention Network with Adaptive Variational Autoencoder and Adversarial Learning for Expressive Text-to-Speech Synthesis,Yu Gu et.al.,2024-10-17,,https://arxiv.org/abs/2410.13288,
2410.13198,Failing Forward: Improving Generative Error Correction for ASR with Synthetic Data and Retrieval Augmentation,Sreyan Ghosh et.al.,2024-10-17,,https://arxiv.org/abs/2410.13198,
2410.12359,ERVQ: Enhanced Residual Vector Quantization with Intra-and-Inter-Codebook Optimization for Neural Audio Codecs,Rui-Chen Zheng et.al.,2024-10-16,,https://arxiv.org/abs/2410.12359,
2410.06885,F5-TTS: A Fairytaler that Fakes Fluent and Faithful Speech with Flow Matching,Yushen Chen et.al.,2024-10-15,,https://arxiv.org/abs/2410.06885,
2410.11127,IsoChronoMeter: A simple and effective isochronic translation evaluation metric,Nikolai Rozanov et.al.,2024-10-14,,https://arxiv.org/abs/2410.11127,
2410.11097,DMDSpeech: Distilled Diffusion Model Surpassing The Teacher in Zero-shot Speech Synthesis via Direct Metric Optimization,Yingahao Aaron Li et.al.,2024-10-14,,https://arxiv.org/abs/2410.11097,
2410.09524,Emphasis Rendering for Conversational Text-to-Speech with Multi-modal Multi-scale Context Modeling,Rui Liu et.al.,2024-10-12,,https://arxiv.org/abs/2410.09524,
2410.07880,Unsupervised Data Validation Methods for Efficient Model Training,Yurii Paniv et.al.,2024-10-10,,https://arxiv.org/abs/2410.07880,
2410.04324,SONAR: A Synthetic AI-Audio Detection Framework and Benchmark,Xiang Li et.al.,2024-10-10,,https://arxiv.org/abs/2410.04324,
2410.06787,Efficient training strategies for natural sounding speech synthesis and speaker adaptation based on FastPitch,Teodora Răgman et.al.,2024-10-09,,https://arxiv.org/abs/2410.06787,
2410.06608,Bahasa Harmony: A Comprehensive Dataset for Bahasa Text-to-Speech Synthesis with Discrete Codec Modeling of EnGen-TTS,Onkar Kishor Susladkar et.al.,2024-10-09,,https://arxiv.org/abs/2410.06608,
2410.06572,Can DeepFake Speech be Reliably Detected?,Hongbin Liu et.al.,2024-10-09,,https://arxiv.org/abs/2410.06572,
2410.04690,SegINR: Segment-wise Implicit Neural Representation for Sequence Alignment in Neural Text-to-Speech,Minchan Kim et.al.,2024-10-07,,https://arxiv.org/abs/2410.04690,
2410.04380,HALL-E: Hierarchical Neural Codec Language Model for Minute-Long Zero-Shot Text-to-Speech Synthesis,Yuto Nishimura et.al.,2024-10-06,,https://arxiv.org/abs/2410.04380,
2410.04017,Adversarial Attacks and Robust Defenses in Speaker Embedding based Zero-Shot Text-to-Speech System,Ze Li et.al.,2024-10-05,,https://arxiv.org/abs/2410.04017,
2410.03459,Generative Semantic Communication for Text-to-Speech Synthesis,Jiahao Zheng et.al.,2024-10-04,,https://arxiv.org/abs/2410.03459,
2410.03298,Textless Streaming Speech-to-Speech Translation using Semantic Speech Tokens,Jinzheng Zhao et.al.,2024-10-04,,https://arxiv.org/abs/2410.03298,
2410.03268,Narrative Player: Reviving Data Narratives with Visuals,Zekai Shao et.al.,2024-10-04,,https://arxiv.org/abs/2410.03268,
2410.03192,MultiVerse: Efficient and Expressive Zero-Shot Multi-Task Text-to-Speech,Taejun Bak et.al.,2024-10-04,,https://arxiv.org/abs/2410.03192,
2410.03751,Recent Advances in Speech Language Models: A Survey,Wenqian Cui et.al.,2024-10-01,,https://arxiv.org/abs/2410.03751,
2410.01108,Augmentation through Laundering Attacks for Audio Spoof Detection,Hashim Ali et.al.,2024-10-01,,https://arxiv.org/abs/2410.01108,
2410.00767,Zero-Shot Text-to-Speech from Continuous Text Streams,Trung Dang et.al.,2024-10-01,,https://arxiv.org/abs/2410.00767,
2410.00316,EmoKnob: Enhance Voice Cloning with Fine-Grained Emotion Control,Haozhe Chen et.al.,2024-10-01,,https://arxiv.org/abs/2410.00316,
2409.20374,Word-wise intonation model for cross-language TTS systems,Tomilov A. A. et.al.,2024-09-30,,https://arxiv.org/abs/2409.20374,
2409.18622,Audio-Based Linguistic Feature Extraction for Enhancing Multi-lingual and Low-Resource Text-to-Speech,Youngjae Kim et.al.,2024-09-27,,https://arxiv.org/abs/2409.18622,
2409.17452,Description-based Controllable Text-to-Speech with Cross-Lingual Voice Control,Ryuichi Yamamoto et.al.,2024-09-26,,https://arxiv.org/abs/2409.17452,
2409.17364,Exploring synthetic data for cross-speaker style transfer in style representation based TTS,Lucas H. Ueda et.al.,2024-09-25,,https://arxiv.org/abs/2409.17364,
2409.16681,Emotional Dimension Control in Language Model-Based Text-to-Speech: Spanning a Broad Spectrum of Human Emotions,Kun Zhou et.al.,2024-09-25,,https://arxiv.org/abs/2409.16681,
2409.16644,Enabling Auditory Large Language Models for Automatic Speech Quality Evaluation,Siyin Wang et.al.,2024-09-25,,https://arxiv.org/abs/2409.16644,
2409.16404,FastTalker: Jointly Generating Speech and Conversational Gestures from Text,Zixin Guo et.al.,2024-09-24,,https://arxiv.org/abs/2409.16404,
2409.16376,Beyond Text-to-Text: An Overview of Multimodal and Generative Artificial Intelligence for Education Using Topic Modeling,Ville Heilala et.al.,2024-09-24,,https://arxiv.org/abs/2409.16376,
2409.16203,Facial Expression-Enhanced TTS: Combining Face Representation and Emotion Intensity for Adaptive Speech,Yunji Chu et.al.,2024-09-24,,https://arxiv.org/abs/2409.16203,
2409.15760,NanoVoice: Efficient Speaker-Adaptive Text-to-Speech for Multiple Speakers,Nohil Park et.al.,2024-09-24,,https://arxiv.org/abs/2409.15760,
2409.15759,VoiceGuider: Enhancing Out-of-Domain Performance in Parameter-Efficient Speaker-Adaptive Text-to-Speech via Autoguidance,Jiheum Yeom et.al.,2024-09-24,,https://arxiv.org/abs/2409.15759,
2409.15741,StyleFusion TTS: Multimodal Style-control and Enhanced Feature Fusion for Zero-shot Text-to-speech Synthesis,Zhiyong Chen et.al.,2024-09-24,,https://arxiv.org/abs/2409.15741,
2409.15180,A Comprehensive Survey with Critical Analysis for Deepfake Speech Detection,Lam Pham et.al.,2024-09-23,,https://arxiv.org/abs/2409.15180,
2409.14743,LlamaPartialSpoof: An LLM-Driven Fake Speech Dataset Simulating Disinformation Generation,Hieu-Thi Luong et.al.,2024-09-23,,https://arxiv.org/abs/2409.14743,
2409.13910,Zero-shot Cross-lingual Voice Transfer for TTS,Fadi Biadsy et.al.,2024-09-20,,https://arxiv.org/abs/2409.13910,
2409.13793,On the Feasibility of Fully AI-automated Vishing Attacks,João Figueiredo et.al.,2024-09-20,,https://arxiv.org/abs/2409.13793,
2409.12745,Enhancing Synthetic Training Data for Speech Commands: From ASR-Based Filtering to Domain Adaptation in SSL Latent Space,Sebastião Quintas et.al.,2024-09-19,,https://arxiv.org/abs/2409.12745,
2409.12403,Preference Alignment Improves Language Model-Based TTS,Jinchuan Tian et.al.,2024-09-19,,https://arxiv.org/abs/2409.12403,
2409.11261,The Art of Storytelling: Multi-Agent Generative AI for Dynamic Multimodal Narratives,Samee Arif et.al.,2024-09-19,,https://arxiv.org/abs/2409.11261,
2409.12117,Low Frame-rate Speech Codec: a Codec Designed for Fast High-quality Speech LLM Training and Inference,Edresson Casanova et.al.,2024-09-18,,https://arxiv.org/abs/2409.12117,
2409.11915,Exploring an Inter-Pausal Unit (IPU) based Approach for Indic End-to-End TTS Systems,Anusha Prakash et.al.,2024-09-18,,https://arxiv.org/abs/2409.11915,
2409.11835,DPI-TTS: Directional Patch Interaction for Fast-Converging and Style Temporal Modeling in Text-to-Speech,Xin Qi et.al.,2024-09-18,,https://arxiv.org/abs/2409.11835,
2409.11630,Speaking from Coarse to Fine: Improving Neural Codec Language Model via Multi-Scale Speech Coding and Generation,Haohan Guo et.al.,2024-09-18,,https://arxiv.org/abs/2409.11630,
2409.11308,SpMis: An Investigation of Synthetic Spoken Misinformation Detection,Peizhuo Liu et.al.,2024-09-17,,https://arxiv.org/abs/2409.11308,
2409.08913,HLTCOE JHU Submission to the Voice Privacy Challenge 2024,Henry Li Xinyuan et.al.,2024-09-17,,https://arxiv.org/abs/2409.08913,
2409.10157,Emo-DPO: Controllable Emotional Speech Synthesis through Direct Preference Optimization,Xiaoxue Gao et.al.,2024-09-16,,https://arxiv.org/abs/2409.10157,
2409.10058,StyleTTS-ZS: Efficient High-Quality Zero-Shot Text-to-Speech Synthesis with Distilled Time-Varying Style Diffusion,Yinghao Aaron Li et.al.,2024-09-16,,https://arxiv.org/abs/2409.10058,
2409.09891,Acquiring Pronunciation Knowledge from Transcribed Speech Audio via Multi-task Learning,Siqi Sun et.al.,2024-09-15,,https://arxiv.org/abs/2409.09891,
2409.09351,E1 TTS: Simple and Fast Non-Autoregressive TTS,Zhijun Liu et.al.,2024-09-14,,https://arxiv.org/abs/2409.09351,
2409.09311,Improving Robustness of Diffusion-Based Zero-Shot Speech Synthesis via Stable Formant Generation,Changjin Han et.al.,2024-09-14,,https://arxiv.org/abs/2409.09311,
2409.09272,SafeEar: Content Privacy-Preserving Audio Deepfake Detection,Xinfeng Li et.al.,2024-09-14,,https://arxiv.org/abs/2409.09272,
2409.07945,Exploring Accessibility Trends and Challenges in Mobile App Development: A Study of Stack Overflow Questions,Amila Indika et.al.,2024-09-14,,https://arxiv.org/abs/2409.07945,
2409.09098,AccentBox: Towards High-Fidelity Zero-Shot Accent Generation,Jinzuomu Zhong et.al.,2024-09-13,,https://arxiv.org/abs/2409.09098,
2409.08711,Text-To-Speech Synthesis In The Wild,Jee-weon Jung et.al.,2024-09-13,,https://arxiv.org/abs/2409.08711,
2409.07556,"SSR-Speech: Towards Stable, Safe and Robust Zero-shot Text-based Speech Editing and Synthesis",Helin Wang et.al.,2024-09-11,,https://arxiv.org/abs/2409.07556,
2409.07390,D-CAPTCHA++: A Study of Resilience of Deepfake CAPTCHA under Transferable Imperceptible Adversarial Attack,Hong-Hanh Nguyen-Le et.al.,2024-09-11,,https://arxiv.org/abs/2409.07390,
2409.07265,Cross-Dialect Text-To-Speech in Pitch-Accent Language Incorporating Multi-Dialect Phoneme-Level BERT,Kazuki Yamauchi et.al.,2024-09-11,,https://arxiv.org/abs/2409.07265,
2409.07151,Zero-Shot Text-to-Speech as Golden Speech Generator: A Systematic Framework and its Applicability in Automatic Pronunciation Assessment,Tien-Hong Lo et.al.,2024-09-11,,https://arxiv.org/abs/2409.07151,
2409.06451,Enhancing Emotional Text-to-Speech Controllability with Natural Language Guidance through Contrastive Learning and Diffusion Models,Xin Jing et.al.,2024-09-10,,https://arxiv.org/abs/2409.06451,
2409.06364,What happens to diffusion model likelihood when your model is conditional?,Mattias Cross et.al.,2024-09-10,,https://arxiv.org/abs/2409.06364,
2409.06348,VoiceWukong: Benchmarking Deepfake Voice Detection,Ziwei Yan et.al.,2024-09-10,,https://arxiv.org/abs/2409.06348,
2409.05004,Disentangling the Prosody and Semantic Information with Pre-trained Model for In-Context Learning based Zero-Shot Voice Conversion,Zhengyang Chen et.al.,2024-09-10,,https://arxiv.org/abs/2409.05004,
2409.03701,LAST: Language Model Aware Speech Tokenization,Arnon Turetzky et.al.,2024-09-10,,https://arxiv.org/abs/2409.03701,
2409.05730,AS-Speech: Adaptive Style For Speech Synthesis,Zhipeng Li et.al.,2024-09-09,,https://arxiv.org/abs/2409.05730,
2409.05356,IndicVoices-R: Unlocking a Massive Multilingual Multi-speaker Speech Corpus for Scaling Indian TTS,Ashwin Sankar et.al.,2024-09-09,,https://arxiv.org/abs/2409.05356,
2409.03283,FireRedTTS: A Foundation Text-To-Speech Framework for Industry-Level Generative Speech Applications,Hao-Han Guo et.al.,2024-09-05,,https://arxiv.org/abs/2409.03283,
2409.02517,Training Universal Vocoders with Feature Smoothing-Based Augmentation Methods for High-Quality TTS Systems,Jeongmin Liu et.al.,2024-09-04,,https://arxiv.org/abs/2409.02517,
2409.01548,VoxHakka: A Dialectally Diverse Multi-speaker Text-to-Speech System for Taiwanese Hakka,Li-Wei Chen et.al.,2024-09-03,,https://arxiv.org/abs/2409.01548,
2409.01217,A multilingual training strategy for low resource Text to Speech,Asma Amalas et.al.,2024-09-02,,https://arxiv.org/abs/2409.01217,
2409.00946,A Framework for Synthetic Audio Conversations Generation using Large Language Models,Kaung Myat Kyaw et.al.,2024-09-02,,https://arxiv.org/abs/2409.00946,
2409.00933,SoCodec: A Semantic-Ordered Multi-Stream Speech Codec for Efficient Language Model Based Text-to-Speech Synthesis,Haohan Guo et.al.,2024-09-02,,https://arxiv.org/abs/2409.00933,
2409.03717,Sample-Efficient Diffusion for Text-To-Speech Synthesis,Justin Lovelace et.al.,2024-09-01,,https://arxiv.org/abs/2409.03717,
2409.00750,MaskGCT: Zero-Shot Text-to-Speech with Masked Generative Codec Transformer,Yuancheng Wang et.al.,2024-09-01,,https://arxiv.org/abs/2409.00750,
2408.17432,SelectTTS: Synthesizing Anyone's Voice via Discrete Unit-Based Frame Selection,Ismail Rasim Ulgen et.al.,2024-08-30,,https://arxiv.org/abs/2408.17432,
2408.17352,AASIST3: KAN-Enhanced AASIST Speech Deepfake Detection using SSL Features and Additional Regularization for the ASVspoof 2024 Challenge,Kirill Borodin et.al.,2024-08-30,,https://arxiv.org/abs/2408.17352,
2408.17175,Codec Does Matter: Exploring the Semantic Shortcoming of Codec for Audio Language Model,Zhen Ye et.al.,2024-08-30,,https://arxiv.org/abs/2408.17175,
2408.17009,Utilizing Speaker Profiles for Impersonation Audio Detection,Hao Gu et.al.,2024-08-30,,https://arxiv.org/abs/2408.17009,
2408.16373,Enabling Beam Search for Language Model-Based Text-to-Speech Synthesis,Zehai Tu et.al.,2024-08-29,,https://arxiv.org/abs/2408.16373,
2408.15775,"Easy, Interpretable, Effective: openSMILE for voice deepfake detection",Octavian Pascu et.al.,2024-08-29,,https://arxiv.org/abs/2408.15775,
2408.15916,Multi-modal Adversarial Training for Zero-Shot Voice Cloning,John Janiczek et.al.,2024-08-28,,https://arxiv.org/abs/2408.15916,
2408.15676,VoxInstruct: Expressive Human Instruction-to-Speech Generation with Unified Multilingual Codec Language Modelling,Yixuan Zhou et.al.,2024-08-28,,https://arxiv.org/abs/2408.15676,
2408.14739,VoiceTailor: Lightweight Plug-In Adapter for Diffusion-Based Personalized Text-to-Speech,Heeseung Kim et.al.,2024-08-28,,https://arxiv.org/abs/2408.14739,
2408.13893,SimpleSpeech 2: Towards Simple and Efficient Text-to-Speech with Flow-based Scalar Latent Transformer Diffusion Models,Dongchao Yang et.al.,2024-08-28,,https://arxiv.org/abs/2408.13893,
2408.14713,StyleSpeech: Parameter-efficient Fine Tuning for Pre-trained Controllable Text-to-Speech,Haowei Lou et.al.,2024-08-27,,https://arxiv.org/abs/2408.14713,
2408.14423,DualSpeech: Enhancing Speaker-Fidelity and Text-Intelligibility Through Dual Classifier-Free Guidance,Jinhyeok Yang et.al.,2024-08-27,,https://arxiv.org/abs/2408.14423,
2408.13970,"Anonymization of Voices in Spaces for Civic Dialogue: Measuring Impact on Empathy, Trust, and Feeling Heard",Wonjune Kang et.al.,2024-08-26,,https://arxiv.org/abs/2408.13970,
2408.12430,Positional Description for Numerical Normalization,Deepanshu Gupta et.al.,2024-08-22,,https://arxiv.org/abs/2408.12430,
2408.12170,VoiceX: A Text-To-Speech Framework for Custom Voices,Silvan Mertes et.al.,2024-08-22,,https://arxiv.org/abs/2408.12170,
