arxiv_id,title,authors,submitted,categories,url,abstract
2511.17181,Investigating self-supervised representations for audio-visual deepfake detection,Dragos-Alexandru Boldisor et.al.,2025-11-21,,https://arxiv.org/abs/2511.17181,
2511.16544,WER is Unaware: Assessing How ASR Errors Distort Clinical Understanding in Patient Facing Dialogue,Zachary Ellis et.al.,2025-11-21,,https://arxiv.org/abs/2511.16544,
2511.16757,Revisiting Audio-language Pretraining for Learning General-purpose Audio Representation,Wei-Cheng Tseng et.al.,2025-11-20,,https://arxiv.org/abs/2511.16757,
2511.16639,Codec2Vec: Self-Supervised Speech Representation Learning Using Neural Speech Codecs,Wei-Cheng Tseng et.al.,2025-11-20,,https://arxiv.org/abs/2511.16639,
2511.16114,SceneGuard: Training-Time Voice Protection with Scene-Consistent Audible Background Noise,Rui Sang et.al.,2025-11-20,,https://arxiv.org/abs/2511.16114,
2511.15848,Step-Audio-R1 Technical Report,Fei Tian et.al.,2025-11-19,,https://arxiv.org/abs/2511.15848,
2511.15766,A Generalized Weighted Overlap-Add (WOLA) Filter Bank for Improved Subband System Identification,Mohit Sharma et.al.,2025-11-19,,https://arxiv.org/abs/2511.15766,
2511.15253,PresentCoach: Dual-Agent Presentation Coaching through Exemplars and Interactive Feedback,Sirui Chen et.al.,2025-11-19,,https://arxiv.org/abs/2511.15253,
2511.15145,Auden-Voice: General-Purpose Voice Encoder for Speech and Language Understanding,Mingyue Huo et.al.,2025-11-19,,https://arxiv.org/abs/2511.15145,
2511.15038,Aligning Generative Music AI with Human Preferences: Methods and Challenges,Dorien Herremans et.al.,2025-11-19,,https://arxiv.org/abs/2511.15038,
2511.14969,Quality-Controlled Multimodal Emotion Recognition in Conversations with Identity-Based Transfer Learning and MAMBA Fusion,Zanxu Wang et.al.,2025-11-18,,https://arxiv.org/abs/2511.14969,
2511.14852,PolyKAN: Efficient Fused GPU Operators for Polynomial Kolmogorov-Arnold Network Variants,Mingkun Yu et.al.,2025-11-18,,https://arxiv.org/abs/2511.14852,
2511.14824,Voiced-Aware Style Extraction and Style Direction Adjustment for Expressive Text-to-Speech,Nam-Gyu Kim et.al.,2025-11-18,,https://arxiv.org/abs/2511.14824,
2511.14688,Ground Truth Generation for Multilingual Historical NLP using LLMs,Clovis Gladstone et.al.,2025-11-18,,https://arxiv.org/abs/2511.14688,
2511.14410,"TTA: Transcribe, Translate and Alignment for Cross-lingual Speech Representation",Wei Liu et.al.,2025-11-18,,https://arxiv.org/abs/2511.14410,
2511.14255,AfriSpeech-MultiBench: A Verticalized Multidomain Multicountry Benchmark Suite for African Accented English ASR,Gabrial Zencha Ashungafac et.al.,2025-11-18,,https://arxiv.org/abs/2511.14255,
2511.14249,Towards Authentic Movie Dubbing with Retrieve-Augmented Director-Actor Interaction Learning,Rui Liu et.al.,2025-11-18,,https://arxiv.org/abs/2511.14249,
2511.14223,StreamingTalker: Audio-driven 3D Facial Animation with Autoregressive Diffusion Model,Yifan Yang et.al.,2025-11-18,,https://arxiv.org/abs/2511.14223,
2511.14138,FxSearcher: gradient-free text-driven audio transformation,Hojoon Ki et.al.,2025-11-18,,https://arxiv.org/abs/2511.14138,
2511.13918,"Human-centric Maintenance Process Through Integration of AI, Speech, and AR",Parul Khanna et.al.,2025-11-17,,https://arxiv.org/abs/2511.13918,
2511.13802,Passive Dementia Screening via Facial Temporal Micro-Dynamics Analysis of In-the-Wild Talking-Head Video,Filippo Cenacchi. Longbing Cao et.al.,2025-11-17,,https://arxiv.org/abs/2511.13802,
2511.13300,PASE: Leveraging the Phonological Prior of WavLM for Low-Hallucination Generative Speech Enhancement,Xiaobin Rong et.al.,2025-11-17,,https://arxiv.org/abs/2511.13300,
2511.13238,Computational Measurement of Political Positions: A Review of Text-Based Ideal Point Estimation Algorithms,Patrick Parschan et.al.,2025-11-17,,https://arxiv.org/abs/2511.13238,
2511.13219,FoleyBench: A Benchmark For Video-to-Audio Models,Satvik Dixit et.al.,2025-11-17,,https://arxiv.org/abs/2511.13219,
2511.13159,Distinguishing Repetition Disfluency from Morphological Reduplication in Bangla ASR Transcripts: A Novel Corpus and Benchmarking Analysis,Zaara Zabeen Arpa et.al.,2025-11-17,,https://arxiv.org/abs/2511.13159,
2511.13078,A Smart-Glasses for Emergency Medical Services via Multimodal Multitask Learning,Liuyi Jin et.al.,2025-11-17,,https://arxiv.org/abs/2511.13078,
2511.12964,CalibrateMix: Guided-Mixup Calibration of Image Semi-Supervised Models,Mehrab Mustafy Rahman et.al.,2025-11-17,,https://arxiv.org/abs/2511.12964,
2511.12690,Improving Direct Persian-English Speech-to-Speech Translation with Discrete Units and Synthetic Parallel Data,Sina Rashidi et.al.,2025-11-16,,https://arxiv.org/abs/2511.12690,
2511.12662,Hi-Reco: High-Fidelity Real-Time Conversational Digital Humans,Hongbin Huang et.al.,2025-11-16,,https://arxiv.org/abs/2511.12662,
2511.12609,"Uni-MoE-2.0-Omni: Scaling Language-Centric Omnimodal Large Model with Advanced MoE, Training and Data",Yunxin Li et.al.,2025-11-16,,https://arxiv.org/abs/2511.12609,
2511.12452,DenseAnnotate: Enabling Scalable Dense Caption Collection for Images and 3D Scenes via Spoken Descriptions,Xiaoyu Lin et.al.,2025-11-16,,https://arxiv.org/abs/2511.12452,
2511.11473,Proactive Hearing Assistants that Isolate Egocentric Conversations,Guilin Hu et.al.,2025-11-14,,https://arxiv.org/abs/2511.11473,
2511.11285,Language-Aided State Estimation,Yuki Miyoshi et.al.,2025-11-14,,https://arxiv.org/abs/2511.11285,
2511.11108,Analysing Personal Attacks in U.S. Presidential Debates,Ruban Goyal et.al.,2025-11-14,,https://arxiv.org/abs/2511.11108,
2511.11104,CLARITY: Contextual Linguistic Adaptation and Accent Retrieval for Dual-Bias Mitigation in Text-to-Speech Generation,Crystal Min Hui Poon et.al.,2025-11-14,,https://arxiv.org/abs/2511.11104,
2511.10935,CAT-Net: A Cross-Attention Tone Network for Cross-Subject EEG-EMG Fusion Tone Decoding,Yifan Zhuang et.al.,2025-11-14,,https://arxiv.org/abs/2511.10935,
2511.10913,"Synthetic Voices, Real Threats: Evaluating Large Text-to-Speech Models in Generating Harmful Audio",Guangke Chen et.al.,2025-11-14,,https://arxiv.org/abs/2511.10913,
2511.10793,"Curved Worlds, Clear Boundaries: Generalizing Speech Deepfake Detection using Hyperbolic and Spherical Geometry Spaces",Farhan Sheth et.al.,2025-11-13,,https://arxiv.org/abs/2511.10793,
2511.10790,Towards Attribution of Generators and Emotional Manipulation in Cross-Lingual Synthetic Speech using Geometric Learning,Girish et.al.,2025-11-13,,https://arxiv.org/abs/2511.10790,
2511.10289,Music Flamingo: Scaling Music Understanding in Audio Language Models,Sreyan Ghosh et.al.,2025-11-13,,https://arxiv.org/abs/2511.10289,
2511.10232,VocalNet-M2: Advancing Low-Latency Spoken Language Modeling via Integrated Multi-Codebook Tokenization and Multi-Token Prediction,Yuhao Wang et.al.,2025-11-13,,https://arxiv.org/abs/2511.10232,
2511.10222,Speech-Audio Compositional Attacks on Multimodal LLMs and Their Mitigation with SALMONN-Guard,Yudong Yang et.al.,2025-11-13,,https://arxiv.org/abs/2511.10222,
2511.10190,Towards Leveraging Sequential Structure in Animal Vocalizations,Eklavya Sarkar et.al.,2025-11-13,,https://arxiv.org/abs/2511.10190,
2511.10112,FabasedVC: Enhancing Voice Conversion with Text Modality Fusion and Phoneme-Level SSL Features,Wenyu Wang et.al.,2025-11-13,,https://arxiv.org/abs/2511.10112,
2511.10076,Mitigating Error Accumulation in Co-Speech Motion Generation via Global Rotation Diffusion and Multi-Level Constraints,Xiangyue Zhang et.al.,2025-11-13,,https://arxiv.org/abs/2511.10076,
2511.09995,Time-Layer Adaptive Alignment for Speaker Similarity in Flow-Matching Based Zero-Shot TTS,Haoyu Li et.al.,2025-11-13,,https://arxiv.org/abs/2511.09995,
2511.09918,MINDS: A Cross-cultural Dialogue Corpus for Social Norm Classification and Adherence Detection,Pritish Sahu et.al.,2025-11-13,,https://arxiv.org/abs/2511.09918,
2511.09282,End-to-end Contrastive Language-Speech Pretraining Model For Long-form Spoken Question Answering,Jiliang Hu et.al.,2025-11-12,,https://arxiv.org/abs/2511.09282,
2511.07135,Generating Novel and Realistic Speakers for Voice Conversion,Meiying Melissa Chen et.al.,2025-11-10,,https://arxiv.org/abs/2511.07135,
2511.07099,E2E-VGuard: Adversarial Prevention for Production LLM-based End-To-End Speech Synthesis,Zhisheng Zhang et.al.,2025-11-10,,https://arxiv.org/abs/2511.07099,
2511.06246,IDMap: A Pseudo-Speaker Generator Framework Based on Speaker Identity Index to Vector Mapping,Zeyan Liu et.al.,2025-11-09,,https://arxiv.org/abs/2511.06246,
2511.05143,Synthesizing speech with selected perceptual voice qualities - A case study with creaky voice,Frederik Rautenberg et.al.,2025-11-07,,https://arxiv.org/abs/2511.05143,
2511.03601,Step-Audio-EditX Technical Report,Chao Yan et.al.,2025-11-05,,https://arxiv.org/abs/2511.03601,
2511.03080,PolyNorm: Few-Shot LLM-Based Text Normalization for Text-to-Speech,Michel Wong et.al.,2025-11-05,,https://arxiv.org/abs/2511.03080,
2511.02270,Augmenting Open-Vocabulary Dysarthric Speech Assessment with Human Perceptual Supervision,Kaimeng Jia et.al.,2025-11-04,,https://arxiv.org/abs/2511.02270,
2511.02104,Toward Objective and Interpretable Prosody Evaluation in Text-to-Speech: A Linguistically Motivated Approach,Cedric Chan et.al.,2025-11-03,,https://arxiv.org/abs/2511.02104,
2510.27247,Reconstructing Unseen Sentences from Speech-related Biosignals for Open-vocabulary Neural Communication,Deok-Seon Kim et.al.,2025-10-31,,https://arxiv.org/abs/2510.27247,
2510.24530,Levée d'ambiguïtés par grammaires locales,Eric G. C. Laporte et.al.,2025-10-28,,https://arxiv.org/abs/2510.24530,
2510.24372,Bayesian Speech synthesizers Can Learn from Multiple Teachers,Ziyang Zhang et.al.,2025-10-28,,https://arxiv.org/abs/2510.24372,
2510.23969,emg2speech: synthesizing speech from electromyography using self-supervised speech models,Harshavardhana T. Gowda et.al.,2025-10-28,,https://arxiv.org/abs/2510.23969,
2510.23541,SoulX-Podcast: Towards Realistic Long-form Podcasts with Dialectal and Paralinguistic Diversity,Hanke Xie et.al.,2025-10-28,,https://arxiv.org/abs/2510.23541,
2510.25178,SFMS-ALR: Script-First Multilingual Speech Synthesis with Adaptive Locale Resolution,Dharma Teja Donepudi et.al.,2025-10-27,,https://arxiv.org/abs/2510.25178,
2510.22588,UltraVoice: Scaling Fine-Grained Style-Controlled Speech Conversations for Spoken Dialogue Models,Wenming Tu et.al.,2025-10-26,,https://arxiv.org/abs/2510.22588,
2510.21685,StylePitcher: Generating Style-Following and Expressive Pitch Curves for Versatile Singing Tasks,Jingyue Huang et.al.,2025-10-24,,https://arxiv.org/abs/2510.21685,
2510.20210,Vox-Evaluator: Enhancing Stability and Fidelity for Zero-shot TTS with A Multi-Level Evaluator,Hualei Wang et.al.,2025-10-23,,https://arxiv.org/abs/2510.20210,
2510.20113,SpeechAgent: An End-to-End Mobile Infrastructure for Speech Impairment Assistance,Haowei Lou et.al.,2025-10-23,,https://arxiv.org/abs/2510.20113,
2510.19641,Style Attack Disguise: When Fonts Become a Camouflage for Adversarial Intent,Yangshijie Zhang et.al.,2025-10-22,,https://arxiv.org/abs/2510.19641,
2510.19509,Which Evaluation for Which Model? A Taxonomy for Speech Model Assessment,Maureen de Seyssel et.al.,2025-10-22,,https://arxiv.org/abs/2510.19509,
2510.19414,EchoFake: A Replay-Aware Dataset for Practical Speech Deepfake Detection,Tong Zhang et.al.,2025-10-22,,https://arxiv.org/abs/2510.19414,
2510.16192,VoiceMorph: How AI Voice Morphing Reveals the Boundaries of Auditory Self-Recognition,Kye Shimizu et.al.,2025-10-22,,https://arxiv.org/abs/2510.16192,
2510.18938,StutterZero and StutterFormer: End-to-End Speech Conversion for Stuttering Transcription and Correction,Qianheng Xu et.al.,2025-10-21,,https://arxiv.org/abs/2510.18938,
2510.18355,KrishokBondhu: A Retrieval-Augmented Voice-Based Agricultural Advisory Call Center for Bengali Farmers,Mohd Ruhul Ameen et.al.,2025-10-21,,https://arxiv.org/abs/2510.18355,
2510.18308,ParaStyleTTS: Toward Efficient and Robust Paralinguistic Style Control for Expressive Text-to-Speech Generation,Haowei Lou et.al.,2025-10-21,,https://arxiv.org/abs/2510.18308,
2510.16718,U-Codec: Ultra Low Frame-rate Neural Speech Codec for Fast High-fidelity Speech Generation,Xusheng Yang et.al.,2025-10-19,,https://arxiv.org/abs/2510.16718,
2510.16497,Edge-Based Speech Transcription and Synthesis for Kinyarwanda and Swahili Languages,Pacome Simon Mbonimpa et.al.,2025-10-18,,https://arxiv.org/abs/2510.16497,
2510.14628,RLAIF-SPA: Optimizing LLM-based Emotional Speech Synthesis via RLAIF,Qing Yang et.al.,2025-10-16,,https://arxiv.org/abs/2510.14628,
2510.13747,InteractiveOmni: A Unified Omni-modal Model for Audio-Visual Multi-turn Dialogue,Wenwen Tong et.al.,2025-10-15,,https://arxiv.org/abs/2510.13747,
2510.13632,Closing the Gap Between Text and Speech Understanding in LLMs,Santiago Cuervo et.al.,2025-10-15,,https://arxiv.org/abs/2510.13632,
2510.13293,Mismatch Aware Guidance for Robust Emotion Control in Auto-Regressive TTS Models,Yizhou Peng et.al.,2025-10-15,,https://arxiv.org/abs/2510.13293,
2510.12210,DiSTAR: Diffusion over a Scalable Token Autoregressive Representation for Speech Generation,Yakun Song et.al.,2025-10-15,,https://arxiv.org/abs/2510.12210,
2510.12995,Continuous-Token Diffusion for Speaker-Referenced TTS in Multimodal LLMs,Xinlu He et.al.,2025-10-14,,https://arxiv.org/abs/2510.12995,
2510.12316,Beating Harmful Stereotypes Through Facts: RAG-based Counter-speech Generation,Greta Damo et.al.,2025-10-14,,https://arxiv.org/abs/2510.12316,
2510.10774,ParsVoice: A Large-Scale Multi-Speaker Persian Speech Corpus for Text-to-Speech Synthesis,Mohammad Javad Ranjbar Kalahroodi et.al.,2025-10-14,,https://arxiv.org/abs/2510.10774,
2510.10396,MRSAudio: A Large-Scale Multimodal Recorded Spatial Audio Dataset with Refined Annotations,Wenxiang Guo et.al.,2025-10-14,,https://arxiv.org/abs/2510.10396,
2510.11646,BridgeCode: A Dual Speech Representation Paradigm for Autoregressive Zero-Shot Text-to-Speech Synthesis,Jingyuan Xing et.al.,2025-10-13,,https://arxiv.org/abs/2510.11646,
2510.11124,Perturbation Self-Supervised Representations for Cross-Lingual Emotion TTS: Stage-Wise Modeling of Emotion and Speaker,Cheng Gong et.al.,2025-10-13,,https://arxiv.org/abs/2510.11124,
2510.09592,Mind-Paced Speaking: A Dual-Brain Approach to Real-Time Reasoning in Spoken Language Models,Donghang Wu et.al.,2025-10-10,,https://arxiv.org/abs/2510.09592,
2510.09061,O_O-VC: Synthetic Data-Driven One-to-One Alignment for Any-to-Any Voice Conversion,Huu Tuong Tu et.al.,2025-10-10,,https://arxiv.org/abs/2510.09061,
2510.09016,DiTSinger: Scaling Singing Voice Synthesis with Diffusion Transformer and Implicit Alignment,Zongcai Du et.al.,2025-10-10,,https://arxiv.org/abs/2510.09016,
2510.08373,DialoSpeech: Dual-Speaker Dialogue Generation with LLM and Flow Matching,Hanke Xie et.al.,2025-10-09,,https://arxiv.org/abs/2510.08373,
2510.07979,IntMeanFlow: Few-step Speech Generation with Integral Velocity Distillation,Wei Wang et.al.,2025-10-09,,https://arxiv.org/abs/2510.07979,
2510.07096,Making Machines Sound Sarcastic: LLM-Enhanced and Retrieval-Guided Sarcastic Speech Synthesis,Zhu Li et.al.,2025-10-08,,https://arxiv.org/abs/2510.07096,
2510.06927,Towards Responsible Evaluation for Text-to-Speech,Yifan Yang et.al.,2025-10-08,,https://arxiv.org/abs/2510.06927,
2510.06706,XLSR-Kanformer: A KAN-Intergrated model for Synthetic Speech Detection,Phuong Tuan Dat et.al.,2025-10-08,,https://arxiv.org/abs/2510.06706,
2510.05984,ECTSpeech: Enhancing Efficient Speech Synthesis via Easy Consistency Tuning,Tao Zhu et.al.,2025-10-07,,https://arxiv.org/abs/2510.05984,
2510.05799,Data-efficient Targeted Token-level Preference Optimization for LLM-based Text-to-Speech,Rikuto Kotoge et.al.,2025-10-07,,https://arxiv.org/abs/2510.05799,
2510.05718,Investigation of perception inconsistency in speaker embedding for asynchronous voice anonymization,Rui Wang et.al.,2025-10-07,,https://arxiv.org/abs/2510.05718,
2510.05696,Sparse deepfake detection promotes better disentanglement,Antoine Teissier et.al.,2025-10-07,,https://arxiv.org/abs/2510.05696,
2510.05619,Teaching Machines to Speak Using Articulatory Control,Akshay Anand et.al.,2025-10-07,,https://arxiv.org/abs/2510.05619,
2510.03387,Synthetic Audio Forensics Evaluation (SAFE) Challenge,Kirill Trapeznikov et.al.,2025-10-07,,https://arxiv.org/abs/2510.03387,
2510.05096,Paper2Video: Automatic Video Generation from Scientific Papers,Zeyu Zhu et.al.,2025-10-06,,https://arxiv.org/abs/2510.05096,
2510.04738,"Speak, Edit, Repeat: High-Fidelity Voice Editing and Zero-Shot TTS with Cross-Attentive Mamba",Baher Mohammad et.al.,2025-10-06,,https://arxiv.org/abs/2510.04738,
2510.04593,UniVoice: Unifying Autoregressive ASR and Flow-Matching based TTS with Large Language Models,Wenhao Guan et.al.,2025-10-06,,https://arxiv.org/abs/2510.04593,
2510.04157,GDiffuSE: Diffusion-based speech enhancement with noise model guidance,Efrayim Yanir et.al.,2025-10-05,,https://arxiv.org/abs/2510.04157,
2510.03986,"A Multilingual Framework for Dysarthria: Detection, Severity Classification, Speech-to-Text, and Clean Speech Generation",Ananya Raghu et.al.,2025-10-05,,https://arxiv.org/abs/2510.03986,
2510.02848,Flamed-TTS: Flow Matching Attention-Free Models for Efficient Generating and Dynamic Pacing Zero-shot Text-to-Speech,Hieu-Nghia Huynh-Nguyen et.al.,2025-10-03,,https://arxiv.org/abs/2510.02848,
2510.01722,Emotional Text-To-Speech Based on Mutual-Information-Guided Emotion-Timbre Disentanglement,Jianing Yang et.al.,2025-10-02,,https://arxiv.org/abs/2510.01722,
2510.00499,MOSS-Speech: Towards True Speech-to-Speech Models Without Text Guidance,Xingjian Zhao et.al.,2025-10-02,,https://arxiv.org/abs/2510.00499,
2510.00743,From Scores to Preferences: Redefining MOS Benchmarking for Speech Quality Reward Modeling,Yifei Cao et.al.,2025-10-01,,https://arxiv.org/abs/2510.00743,
2509.26514,BatonVoice: An Operationalist Framework for Enhancing Controllable Speech Synthesis with Linguistic Intelligence from LLMs,Yue Wang et.al.,2025-09-30,,https://arxiv.org/abs/2509.26514,
2509.25842,HiStyle: Hierarchical Style Embedding Predictor for Text-Prompt-Guided Controllable Speech Synthesis,Ziyu Zhang et.al.,2025-09-30,,https://arxiv.org/abs/2509.25842,
2509.25670,LTA-L2S: Lexical Tone-Aware Lip-to-Speech Synthesis for Mandarin with Cross-Lingual Transfer Learning,Kang Yang et.al.,2025-09-30,,https://arxiv.org/abs/2509.25670,
2509.24773,VSSFlow: Unifying Video-conditioned Sound and Speech Generation via Joint Learning,Xin Cheng et.al.,2025-09-30,,https://arxiv.org/abs/2509.24773,
2509.25416,Emotion-Aligned Generation in Diffusion Text to Speech Models via Preference-Guided Optimization,Jiacheng Shi et.al.,2025-09-29,,https://arxiv.org/abs/2509.25416,
2509.25131,MGM-Omni: Scaling Omni LLMs to Personalized Long-Horizon Speech,Chengyao Wang et.al.,2025-09-29,,https://arxiv.org/abs/2509.25131,
2509.24650,VoxCPM: Tokenizer-Free TTS for Context-Aware Speech Generation and True-to-Life Voice Cloning,Yixuan Zhou et.al.,2025-09-29,,https://arxiv.org/abs/2509.24650,
2509.24629,Word-Level Emotional Expression Control in Zero-Shot Text-to-Speech Synthesis,Tianrui Wang et.al.,2025-09-29,,https://arxiv.org/abs/2509.24629,
2509.24570,ISSE: An Instruction-Guided Speech Style Editing Dataset And Benchmark,Yun Chen et.al.,2025-09-29,,https://arxiv.org/abs/2509.24570,
2509.24391,UniFlow-Audio: Unified Flow Matching for Audio Generation from Omni-Modalities,Xuenan Xu et.al.,2025-09-29,,https://arxiv.org/abs/2509.24391,
2509.23618,Generalizable Speech Deepfake Detection via Information Bottleneck Enhanced Adversarial Alignment,Pu Huang et.al.,2025-09-28,,https://arxiv.org/abs/2509.23618,
2509.23147,BFA: Real-time Multilingual Text-to-speech Forced Alignment,Abdul Rehman et.al.,2025-09-27,,https://arxiv.org/abs/2509.23147,
2509.20971,i-LAVA: Insights on Low Latency Voice-2-Voice Architecture for Agents,Anupam Purwar et.al.,2025-09-27,,https://arxiv.org/abs/2509.20971,
2509.22808,ArFake: A Multi-Dialect Benchmark and Baselines for Arabic Spoof-Speech Detection,Mohamed Maged et.al.,2025-09-26,,https://arxiv.org/abs/2509.22808,
2509.22167,Semantic-VAE: Semantic-Alignment Latent Representation for Better Speech Synthesis,Zhikang Niu et.al.,2025-09-26,,https://arxiv.org/abs/2509.22167,
2509.22148,Speaker Anonymisation for Speech-based Suicide Risk Detection,Ziyun Cui et.al.,2025-09-26,,https://arxiv.org/abs/2509.22148,
2509.22062,Comprehend and Talk: Text to Speech Synthesis via Dual Language Modeling,Junjie Cao et.al.,2025-09-26,,https://arxiv.org/abs/2509.22062,
2509.21718,Align2Speak: Improving TTS for Low Resource Languages via ASR-Guided Online Preference Optimization,Shehzeen Hussain et.al.,2025-09-26,,https://arxiv.org/abs/2509.21718,
2509.20802,SPADE: Structured Pruning and Adaptive Distillation for Efficient LLM-TTS,Tan Dat Nguyen et.al.,2025-09-26,,https://arxiv.org/abs/2509.20802,
2509.21144,UniSS: Unified Expressive Speech-to-Speech Translation with Your Voice,Sitong Cheng et.al.,2025-09-25,,https://arxiv.org/abs/2509.21144,
2509.19928,"Measuring Prosody Diversity in Zero-Shot TTS: A New Metric, Benchmark, and Exploration",Yifan Yang et.al.,2025-09-25,,https://arxiv.org/abs/2509.19928,
2509.20485,Objective Evaluation of Prosody and Intelligibility in Speech Synthesis via Conditional Prediction of Discrete Tokens,Ismail Rasim Ulgen et.al.,2025-09-24,,https://arxiv.org/abs/2509.20485,
2509.20086,OLaPh: Optimal Language Phonemizer,Johannes Wirth et.al.,2025-09-24,,https://arxiv.org/abs/2509.20086,
2509.19883,CoMelSinger: Discrete Token-Based Zero-Shot Singing Synthesis With Structured Melody Control and Guidance,Junchuan Zhao et.al.,2025-09-24,,https://arxiv.org/abs/2509.19883,
2509.19852,Eliminating stability hallucinations in llm-based tts models via attention guidance,ShiMing Wang et.al.,2025-09-24,,https://arxiv.org/abs/2509.19852,
2509.19812,Efficient Speech Watermarking for Speech Synthesis via Progressive Knowledge Distillation,Yang Cui et.al.,2025-09-24,,https://arxiv.org/abs/2509.19812,
2509.19745,PART: Progressive Alignment Representation Training for Multilingual Speech-To-Text with LLMs,Pei Zhang et.al.,2025-09-24,,https://arxiv.org/abs/2509.19745,
2509.19668,Selective Classifier-free Guidance for Zero-shot Text-to-speech,John Zheng et.al.,2025-09-24,,https://arxiv.org/abs/2509.19668,
2509.19592,Frame-Stacked Local Transformers For Efficient Multi-Codebook Speech Generation,Roy Fejgin et.al.,2025-09-23,,https://arxiv.org/abs/2509.19592,
2509.19001,HD-PPT: Hierarchical Decoding of Content- and Prompt-Preference Tokens for Instruction-based TTS,Sihang Nie et.al.,2025-09-23,,https://arxiv.org/abs/2509.19001,
2509.18928,Direct Preference Optimization for Speech Autoregressive Diffusion Models,Zhijun Liu et.al.,2025-09-23,,https://arxiv.org/abs/2509.18928,
2509.18798,Group Relative Policy Optimization for Text-to-Speech with Large Language Models,Chang Liu et.al.,2025-09-23,,https://arxiv.org/abs/2509.18798,
2509.18569,Explore the Reinforcement Learning for the LLM based ASR and TTS system,Changfeng Gao et.al.,2025-09-23,,https://arxiv.org/abs/2509.18569,
2509.18531,No Verifiable Reward for Prosody: Toward Preference-Guided Prosody Learning in TTS,Seungyoun Shin et.al.,2025-09-23,,https://arxiv.org/abs/2509.18531,
2509.18470,Discrete-time diffusion-like models for speech synthesis,Xiaozhou Tan et.al.,2025-09-22,,https://arxiv.org/abs/2509.18470,
2509.18060,"TMD-TTS: A Unified Tibetan Multi-Dialect Text-to-Speech Synthesis for Ü-Tsang, Amdo and Kham Speech Dataset Generation",Yutong Liu et.al.,2025-09-22,,https://arxiv.org/abs/2509.18060,
2509.17988,Nord-Parl-TTS: Finnish and Swedish TTS Dataset from Parliament Speech,Zirui Li et.al.,2025-09-22,,https://arxiv.org/abs/2509.17988,
2509.17765,Qwen3-Omni Technical Report,Jin Xu et.al.,2025-09-22,,https://arxiv.org/abs/2509.17765,
2509.17516,Audiobook-CC: Controllable Long-context Speech Generation for Multicast Audiobook,Min Liu et.al.,2025-09-22,,https://arxiv.org/abs/2509.17516,
2509.17052,Sidon: Fast and Robust Open-Source Multilingual Speech Restoration for Large-scale Dataset Cleansing,Wataru Nakata et.al.,2025-09-21,,https://arxiv.org/abs/2509.17052,
2509.17021,Bridging the gap between training and inference in LM-based TTS models,Ruonan Zhang et.al.,2025-09-21,,https://arxiv.org/abs/2509.17021,
2509.17006,MBCodec:Thorough disentangle for high-fidelity audio compression,Ruonan Zhang et.al.,2025-09-21,,https://arxiv.org/abs/2509.17006,
2509.14946,SynParaSpeech: Automated Synthesis of Paralinguistic Datasets for Speech Generation and Understanding,Bingsong Bai et.al.,2025-09-20,,https://arxiv.org/abs/2509.14946,
2509.16010,Fed-PISA: Federated Voice Cloning via Personalized Identity-Style Adaptation,Qi Wang et.al.,2025-09-19,,https://arxiv.org/abs/2509.16010,
2509.15969,VoXtream: Full-Stream Text-to-Speech with Extremely Low Latency,Nikita Torgashov et.al.,2025-09-19,,https://arxiv.org/abs/2509.15969,
2509.15845,Deep Dubbing: End-to-End Auto-Audiobook System with Text-to-Timbre and Context-Aware Instruct-TTS,Ziqi Dai et.al.,2025-09-19,,https://arxiv.org/abs/2509.15845,
2509.15626,LibriTTS-VI: A Public Corpus and Novel Methods for Efficient Voice Impression Control,Junki Ohmura et.al.,2025-09-19,,https://arxiv.org/abs/2509.15626,
2509.15492,Beyond Video-to-SFX: Video to Audio Synthesis with Environmentally Aware Speech,Xinlei Niu et.al.,2025-09-19,,https://arxiv.org/abs/2509.15492,
2509.15462,A Novel Semantic Compression Approach for Ultra-low Bandwidth Voice Communication,Ryan Collette et.al.,2025-09-18,,https://arxiv.org/abs/2509.15462,
2509.15373,Frustratingly Easy Data Augmentation for Low-Resource ASR,Katsumi Ibaraki et.al.,2025-09-18,,https://arxiv.org/abs/2509.15373,
