arxiv_id,title,authors,submitted,categories,url,abstract
2605.05927,Minimizing Modality Gap from the Input Side: Your Speech LLM Can Be a Prosody-Aware Text LLM,"Wenqian Cui, Xiao-Hui Li, Daxin Tan, Qiyong Zheng, Irwin King",2026-05-07,cs.CL cs.SD eess.AS,https://arxiv.org/abs/2605.05927,"Speech large language models (SLMs) are typically built from text large language model (TLM) checkpoints, yet they still suffer from a substantial modality gap. Prior work has mainly attempted to reduce this gap from the output side by making speech generation more text-like, but the gap remains. We argue that the key remaining bottleneck lies on the input side. We propose TextPro-SLM, an SLM that makes spoken input more closely resemble that of a prosody-aware text LLM. TextPro-SLM combines WhisperPro, a unified speech encoder that produces synchronized text tokens and prosody embeddings, with an LLM backbone trained to preserve the semantic capabilities of the original TLM while learning paralinguistic understanding. Experiments show that TextPro-SLM achieves the lowest modality gap among leading SLMs at both 3B and 7B scales, while also delivering strong overall performance on paralinguistic understanding tasks. These gains are achieved with only roughly 1,000 hours of LLM training audio, suggesting that reducing the modality gap from the input side is both effective and data-efficient."
2605.02496,Tibetan-TTS:Low-Resource Tibetan Speech Synthesis with Large Model Adaptation,"Jiaxu He, Chao Wang, Jie Lian, Yuqing Cai, Yongxiang Li, Renzeg Duojie, Jie Li",2026-05-04,cs.SD cs.CL,https://arxiv.org/abs/2605.02496,"Tibetan text-to-speech (TTS) has long been challenged by scarce speech resources, significant dialectal variation, and the complex mapping between written text and spoken pronunciation. To address these issues, this work presents, to the best of our knowledge, the first large-model-based Tibetan TTS system in the industry, built upon a large speech synthesis model developed by Xingchen AGI Lab. The proposed system integrates data quality enhancement, Tibetan-oriented text representation and tokenizer adaptation, and cross-lingual adaptive training for low-resource Tibetan speech synthesis. Experimental results show that the system can generate stable, natural, and intelligible Tibetan speech under low-resource conditions. In subjective evaluation, the MOS scores of the syllable-level and BPE-based systems reach 4.28 and 4.35, while their pronunciation accuracies reach 97.6% and 96.6%, respectively, outperforming an external commercial Tibetan TTS interface. These results demonstrate that combining a large-model backbone with Tibetan-oriented text representation adaptation and cross-lingual adaptive training enables highly usable low-resource Tibetan speech synthesis, and also provides a technical foundation for future unified multi-dialect Tibetan speech synthesis."
2605.02223,"Toward Fine-Grained Speech Inpainting Forensics:A Dataset, Method, and Metric for Multi-Region Tampering Localization","Tung Vu, Yen Nguyen, Hai Nguyen, Cuong Pham, Cong Tran",2026-05-04,cs.SD cs.CV,https://arxiv.org/abs/2605.02223,"Recent advances in voice cloning and text-to-speech synthesis have made partial speech manipulation - where an adversary replaces a few words within an utterance to alter its meaning while preserving the speaker's identity - an increasingly realistic threat. Existing audio deepfake detection benchmarks focus on utterance-level binary classification or single-region tampering, leaving a critical gap in detecting and localizing multiple inpainted segments whose count is unknown a priori. We address this gap with three contributions. First, we introduce MIST (Multiregion Inpainting Speech Tampering), a large-scale multilingual dataset spanning 6 languages with 1-3 independently inpainted word-level segments per utterance, generated via LLM-guided semantic replacement and neural voice cloning, with fake content constituting only 2-7% of each utterance. Second, we propose ISA (Iterative Segment Analysis), a backbone-agnostic framework that performs coarse-to-fine sliding-window classification with gap-tolerant region proposal and boundary refinement to recover all tampered regions without prior knowledge of their count. Third, we define SF1@tau, a segment-level F1 metric based on temporal IoU matching that jointly evaluates region count accuracy and localization precision. Zero-shot evaluation reveals that partial inpainting at word granularity remains unsolved by existing deepfake detectors: utterance-level classifiers trained on fully synthesized speech assign near zero fake probability to MIST utterances where only 2-7% of content is manipulated. ISA consistently outperforms non-iterative baselines in this challenging setting, and the dataset, code, and evaluation toolkit are publicly released."
2605.00607,Beyond Decodability: Reconstructing Language Model Representations with an Encoding Probe,"Gaofei Shen, Martijn Bentum, Tom Lentz, Afra Alishahi, Grzegorz Chrupała",2026-05-01,cs.CL eess.AS,https://arxiv.org/abs/2605.00607,"Probing is widely used to study which features can be decoded from language model representations. However, the common decoding probe approach has two limitations that we aim to solve with our new encoding probe approach: contributions of different features to model representations cannot be directly compared, and feature correlations can affect probing results. We present an Encoding Probe that reverses this direction and reconstructs internal representations of models using interpretable features. We evaluate this method on text and speech transformer models, using feature sets spanning acoustics, phonetics, syntax, lexicon, and speaker identity. Our results suggest that speaker-related effects vary strongly across different training objectives and datasets, while syntactic and lexical features contribute independently to reconstruction. These results show that the Encoding Probe provides a complementary perspective on interpreting model representations beyond decodability."
2605.00777,LASE: Language-Adversarial Speaker Encoding for Indic Cross-Script Identity Preservation,Venkata Pushpak Teja Menta,2026-05-01,cs.SD cs.CL eess.AS,https://arxiv.org/abs/2605.00777,"A speaker encoder used in multilingual voice cloning should treat the same speaker identically regardless of which script the audio was uttered in. Off-the-shelf encoders do not, and the failure is accent-conditional. On a 1043-pair Western-accented voice corpus across English, Hindi, Telugu, and Tamil, WavLM-base-plus-sv loses 0.082 absolute cosine similarity when the same voice changes script and ECAPA-TDNN loses 0.105. On a 1369-pair Indian-accented voice corpus, the gap shrinks to 0.006 (WavLM-SV) and 0.044 (ECAPA-TDNN). The leak is largest where it matters most for cross-script TTS: when a system projects a non-Indic-trained voice into Indic scripts. We present LASE (Language-Adversarial Speaker Encoder), a small projection head over frozen WavLM-base-plus trained with two losses: a supervised contrastive loss over voice identity, and a gradient-reversal cross-entropy against a 4-language classifier that pushes the embedding to be language-uninformative while remaining speaker-informative. Trained on 1118 quality-gated cross-script pairs synthesised from 8 commercial multilingual voices, LASE's residual gap is consistent with zero on both corpora (Delta = 0.013 Western, Delta = 0.026 Indian; both bootstrap 95% CIs include zero) and amplifies the cross-script-vs-floor margin 2.4-2.7x over both baselines. An ECAPA+GRL ablation shows the GRL objective improves either backbone but the WavLM choice contributes too. In synthetic multi-speaker diarisation, LASE matches ECAPA-TDNN on cross-script speaker recall (0.788 vs 0.789) with ~100x less training data. We release the r1 checkpoint, both corpora, and the bootstrap recipe."
2604.27607,JaiTTS: A Thai Voice Cloning Model,"Jullajak Karnjanaekarin, Pontakorn Trakuekul, Narongkorn Panitsrisit, Sumana Sumanakul, Vichayuth Nitayasomboon, Nithid Guntasin, Thanavin Denkavin, Attapol T. Rutherford",2026-04-30,cs.CL,https://arxiv.org/abs/2604.27607,"We present JaiTTS-v1.0, a state-of-the-art Thai voice cloning text-to-speech model built through continual training on a large Thai-centric speech corpus. The model architecture is adapted from VoxCPM, a tokenizer-free autoregressive TTS model. JaiTTS-v1.0 directly processes numerals and Thai-English code-switching, which is very common in realistic settings, without explicit text normalization. We test the models on short-duration speech generation and long-duration speech generation, which reflects many real-world use cases. JaiTTS-v1.0 achieves a state-of-the-art CER of 1.94\%, surpassing the human ground truth of 1.98% for short-duration tasks while performing on par with human ground truth for long-duration tasks. In human judgment evaluations, our model wins 283 of 400 pairwise comparisons against commercial flagships, with only 58 losses."
2604.27393,MiniCPM-o 4.5: Towards Real-Time Full-Duplex Omni-Modal Interaction,"Junbo Cui, Bokai Xu, Chongyi Wang, Tianyu Yu, Weiyue Sun, Yingjing Xu, Tianran Wang, Zhihui He, Wenshuo Ma, Tianchi Cai, Jiancheng Gui, Luoyuan Zhang, Xian Sun, Fuwei Huang, Moye Chen, Zhuo Lin, Hanyu Liu, Qingxin Gui, Qingzhe Han, Yuyang Wen, Huiping Liu, Rongkang Wang, Yaqi Zhang, Hongliang Wei, Chi Chen, You Li, Kechen Fang, Jie Zhou, Yuxuan Li, Guoyang Zeng, Chaojun Xiao, Yankai Lin, Xu Han, Maosong Sun, Zhiyuan Liu, Yuan Yao",2026-04-30,cs.CL,https://arxiv.org/abs/2604.27393,"Recent progress in multimodal large language models (MLLMs) has brought AI capabilities from static offline data processing to real-time streaming interaction, yet they still remain far from human-level multimodal interaction. The key bottlenecks are no longer modality coverage or latency alone, but the interaction paradigm itself. First, perception and response are still separated into alternating phases, preventing models from incorporating new inputs for timely adjustment during generation. Second, most current models remain reactive, responding only to explicit user requests instead of acting proactively in the evolving multimodal environment. We present MiniCPM-o 4.5, our latest effort towards human-like multimodal interaction, which mitigates these gaps by real-time full-duplex omni-modal interaction. It can see, listen, and speak simultaneously in real-time, while also exhibiting proactive behaviors such as issuing reminders or comments based on its continuous understanding of the live scene. The key technique behind MiniCPM-o 4.5 is Omni-Flow, a unified streaming framework that aligns omni-modal inputs and outputs along a shared temporal axis. This formulation converts conventional turn-based interaction into a full-duplex, time-aligned process, enabling simultaneous perception and response and allowing proactive behavior to arise within the same framework. With a total of 9B parameters, MiniCPM-o 4.5 approaches Gemini 2.5 Flash in vision-language capabilities, delivering state-of-the-art open-source performance at its scale. It also surpasses Qwen3-Omni-30B-A3B in omni-modal understanding and delivers better speech generation, with significantly higher computation efficiency. Driven by its efficient architecture design and inference optimization, the model can perform real-time full-duplex omni-modal interaction on edge devices with less than 12GB RAM cost."
2604.27232,Targeted Linguistic Analysis of Sign Language Models with Minimal Translation Pairs,"Serpil Karabüklü, Kanishka Misra, Shester Gueuwou, Diane Brentari, Greg Shakhnarovich, Karen Livescu",2026-04-29,cs.CL,https://arxiv.org/abs/2604.27232,"Models of sign language have historically lagged behind those for spoken language (text and speech). Recent work has greatly improved their performance on tasks like sign language translation and isolated sign recognition. However, it remains unclear to what extent existing models capture various linguistic phenomena of sign language, and how well they use cues from the multiple articulators used in sign language (hands, upper body, face). We introduce a new benchmark dataset for American Sign Language, ASL Minimal Translation Pairs (ASL-MTP), divided into multiple types of sign language phenomena and corresponding minimal pairs of translations, for performing such linguistic analyses. As a case study, we use ASL-MTP to analyze a state-of-the-art ASL-to-English translation model. We conduct a targeted analysis of the model by ablating various input cues during training and inference and evaluating on the phenomena in ASL-MTP. Our results show that, while the model performs above chance level on most of the phenomena, it relies strongly on manual cues while often missing crucial non-manual cues."
2604.26417,EmoTransCap: Dataset and Pipeline for Emotion Transition-Aware Speech Captioning in Discourses,"Shuhao Xu, Yifan Hu, Jingjing Wu, Zhihao Du, Zheng Lian, Rui Liu",2026-04-29,cs.CL cs.SD,https://arxiv.org/abs/2604.26417,"Emotion perception and adaptive expression are fundamental capabilities in human-agent interaction. While recent advances in speech emotion captioning (SEC) have improved fine-grained emotional modeling, existing systems remain limited to static, single-emotion characterization within isolated sentences, neglecting dynamic emotional transitions at the discourse level. To address this gap, we propose Emotion Transition-Aware Speech Captioning (EmoTransCap), a paradigm that integrates temporal emotion dynamics with discourse-level speech description. To construct a dataset rich in emotion transitions while enabling scalable expansion, we design an automated pipeline for dataset creation. This is the first large-scale dataset explicitly designed to capture discourse-level emotion transitions. To generate semantically rich descriptions, we incorporate acoustic attributes and temporal cues from discourse-level speech. Our Multi-Task Emotion Transition Recognition (MTETR) model performs joint emotion transition detection and diarization. Leveraging the semantic analysis capabilities of LLMs, we produce two annotation versions: descriptive and instruction-oriented. These data and annotations offer a valuable resource for advancing emotion perception and emotional expressiveness. The dataset enables speech captions that capture emotional transitions, facilitating temporal-dynamic and fine-grained emotion understanding. We also introduce a controllable, transition-aware emotional speech synthesis system at the discourse level, enhancing anthropomorphic emotional expressiveness and supporting emotionally intelligent conversational agents."
2604.26347,The False Resonance: A Critical Examination of Emotion Embedding Similarity for Speech Generation Evaluation,"Yun-Shao Tsai, Yi-Cheng Lin, Huang-Cheng Chou, Tzu-Wen Hsu, Yun-Man Hsu, Chun Wei Chen, Shrikanth Narayanan, Hung-yi Lee",2026-04-29,eess.AS cs.CL,https://arxiv.org/abs/2604.26347,"Objective metrics for emotional expressiveness are vital for speech generation, particularly in expressive synthesis and voice conversion requiring emotional prosody transfer. To quantify this, the field widely relies on emotion similarity between reference and generated samples. This approach computes cosine similarity of embeddings from encoders like emotion2vec, assuming they capture affective cues despite linguistic and speaker variations. We challenge this assumption through controlled adversarial tasks and human alignment tests. Despite high classification accuracy, these latent spaces are unsuitable for zero-shot similarity evaluation. Representational limitations cause linguistic and speaker interference to overshadow emotional features, degrading discriminative ability. Consequently, the metric misaligns with human perception. This acoustic vulnerability reveals it rewards acoustic mimicry over genuine emotional synthesis."
2604.25476,PSP: An Interpretable Per-Dimension Accent Benchmark for Indic Text-to-Speech,Venkata Pushpak Teja Menta,2026-04-28,cs.SD cs.CL,https://arxiv.org/abs/2604.25476,"Standard text-to-speech (TTS) evaluation measures intelligibility (WER, CER) and overall naturalness (MOS, UTMOS) but does not quantify accent. A synthesiser may score well on all four yet sound non-native on features that are phonemic in the target language. For Indic languages, these features include retroflex articulation, aspiration, vowel length, and the Tamil retroflex approximant (letter zha). We present PSP, the Phoneme Substitution Profile, an interpretable, per-phonological-dimension accent benchmark for Indic TTS. PSP decomposes accent into six complementary dimensions: retroflex collapse rate (RR), aspiration fidelity (AF), vowel-length fidelity (LF), Tamil-zha fidelity (ZF), Frechet Audio Distance (FAD), and prosodic signature divergence (PSD). The first four are measured via forced alignment plus native-speaker-centroid acoustic probes over Wav2Vec2-XLS-R layer-9 embeddings; the latter two are corpus-level distributional distances. In this v1 we benchmark four commercial and open-source systems (ElevenLabs v3, Cartesia Sonic-3, Sarvam Bulbul, Indic Parler-TTS) on Hindi, Telugu, and Tamil pilot sets, with a fifth system (Praxy Voice) included on all three languages, plus an R5->R6 case study on Telugu. Three findings: (i) retroflex collapse grows monotonically with phonological difficulty Hindi < Telugu < Tamil (~1%, ~40%, ~68%); (ii) PSP ordering diverges from WER ordering -- commercial WER-leaders do not uniformly lead on retroflex or prosodic fidelity; (iii) no single system is Pareto-optimal across all six dimensions. We release native reference centroids (500 clips per language), 1000-clip embeddings for FAD, 500-clip prosodic feature matrices for PSD, 300-utterance golden sets per language, scoring code under MIT, and centroids under CC-BY. Formal MOS-correlation is deferred to v2; v1 reports five internal-consistency signals plus a native-audio sanity check."
2604.25332,Robust Accent Identification via Voice Conversion and Non-Timbral Embeddings,"Rayane Bakari, Olivier Le Blouch, Nicolas Gengembre, Nicholas Evans",2026-04-28,eess.SP,https://arxiv.org/abs/2604.25332,"Automatic accent identification (AID) remains a challenging task due to the complex variability of accents, the entanglement of accent cues with speaker traits, and the scarcity of reliable accentlabelled data. To address these challenges, we propose a speaker augmentation strategy using voice conversion (VC), with which we generate additional training data by converting original training utterances into different speaker voices while preserving accentual cues. For this purpose, we select two recent VC systems and evaluate their capability to preserve accent. Alternatively, we also explore the use of non-timbral embeddings in AID, for their ability to convey accent information among other non timbral cues. The effectiveness of both methods is demonstrated on the GenAID benchmark, achieving a new state-of-the-art F1-score of 0.66, compared to the previous score of 0.55. Beyond AID, we show that non-timbral embeddings enable accent-controlled Text-to-Speech, producing high-fidelity speech with accurate accent transfer."
2604.26136,"One Voice, Many Tongues: Cross-Lingual Voice Cloning for Scientific Speech","Amanuel Gizachew Abebe, Yasmin Moslem",2026-04-28,eess.AS cs.CL,https://arxiv.org/abs/2604.26136,"Preserving a speaker's voice identity while generating speech in a different language remains a fundamental challenge in spoken language technology, particularly in specialized domains such as scientific communication. In this paper, we address this challenge through our system submission to the International Conference on Spoken Language Translation (IWSLT 2026), the Cross-Lingual Voice Cloning shared task. First, we evaluate several state-of-the-art voice cloning models for cross-lingual speech generation of scientific texts in Arabic, Chinese, and French. Then, we build voice cloning systems based on the OmniVoice foundation model. We employ data augmentation via multi-model ensemble distillation from the ACL 60/60 corpus. We investigate the effect of using this synthetic data for fine-tuning, demonstrating consistent improvements in intelligibility (WER and CER) across languages while preserving speaker similarity."
2604.23909,AMAVA: Adaptive Motion-Aware Video-to-Audio Framework for Visually-Impaired Assistance,"Benjamin Klein, Kazi Ruslan Rahman, Sanchita Ghose",2026-04-26,cs.CV,https://arxiv.org/abs/2604.23909,"Navigational aids for blind and low vision individuals struggle conveying dynamic real-world environments, leading to cognitive overload from continuous, undifferentiated feedback. We present AMAVA, a novel real-time video-to-audio framework that converts mobile device video into contextually relevant sound effects or text-to-speech descriptions. We propose a motion-aware pipeline using a lightweight AI classification model to distinguish between low and high-movement scenes followed by a real-time text-to-audio synthesis pipeline to enhance environmental perception more efficiently. In static environments, AMAVA generates spoken audio scene descriptions for situational awareness. In high-movement situations, it prioritizes safety by delivering sound cues, such as spoken hazard alerts and environmental sound effects. These audio outputs are produced by a decoder-only transformer-based vision-language model with mixture-of-experts and cross-modal attention for visual understanding, in conjunction with neural text-to-speech and natural sound synthesis networks. The proposed framework uses prompt-based caching and category-specific throttling to avoid auditory clutter and minimize latency. We present a comprehensive evaluation of the system, including a real-time navigation study comparing a white cane alone versus with AMAVA, that shows a significant increase in user confidence and perceived safety."
2604.23703,Talking Slide Avatars: Open-Source Multimodal Communication Approach for Teaching,Xinxing Wu,2026-04-26,cs.HC cs.AI cs.CY,https://arxiv.org/abs/2604.23703,"Slide-based teaching is widely used in higher education, yet in online, hybrid, and asynchronous contexts, slides often lose the instructor presence, narrative continuity, and expressive framing that help learners connect with content. Full lecture video can partly restore these qualities, but it is time-consuming to record, revise, and reuse. This study addresses that pedagogical and production challenge by presenting a practice-based analysis of an open-source workflow for creating talking slide avatars for slide-based teaching. The workflow integrates OpenVoice for text-to-speech generation and voice cloning with Ditto-TalkingHead for audio-driven talking-image synthesis, enabling instructors to transform a script and a static portrait into a short narrated video that can be embedded in slide decks or HTML-based lecture materials. Rather than treating this workflow merely as a technical solution, the study frames talking slide avatars as multimodal communication artifacts at the intersection of digital pedagogy, aesthetic education, and art-technology practice. Using a practice-based implementation and analytic reflection approach, the study documents the production pipeline, examines its communicative and aesthetic affordances, and proposes practical guidelines for script length, image selection, pacing, disclosure, accessibility, and ethical use. The study makes three primary contributions: it presents an educator-oriented open-source production model, reframes talking avatars as an educational communication design problem, and proposes a responsible pathway for incorporating generative synthetic media into teaching. It concludes that short, transparent, and carefully designed avatars can humanize slide-based instruction while providing a reusable communicative layer for introductions, transitions, reminders, and recaps across online, hybrid, and asynchronous learning environments."
2604.23742,RTCFake: Speech Deepfake Detection in Real-Time Communication,"Jun Xue, Zhuolin Yi, Yihuan Huang, Yanzhen Ren, Yujie Chen, Cunhang Fan, Zicheng Su, Yonghong Zhang, Bo Cai",2026-04-26,cs.SD,https://arxiv.org/abs/2604.23742,"With the rapid advancement of speech generation technologies, the threat posed by speech deepfakes in real-time communication (RTC) scenarios has intensified. However, existing detection studies mainly focus on offline simulations and struggle to cope with the complex distortions introduced during RTC transmission, including unknown speech enhancement processes (e.g., noise suppression) and codec compression. To address this challenge, we present the first large-scale speech deepfake dataset tailored for RTC scenarios, termed \textit{RTCFake}, totaling approximately 600 hours. The dataset is constructed by transmitting speech through multiple mainstream social media and conferencing platforms (e.g., Zoom), enabling precise pairing between offline and online speech. In addition, we propose a phoneme-guided consistency learning (PCL) strategy that enforces models to learn platform-invariant semantic structural representations. In this paper, the RTCFake dataset is divided into training, development, and evaluation sets. The evaluation set further includes both unseen RTC platforms and unseen complex noise conditions, thereby providing a more realistic and challenging evaluation benchmark for speech deepfake detection. Furthermore, the proposed PCL strategy achieves significant improvements in both cross-platform generalization and noise robustness, offering an effective and generalizable modeling paradigm. The \textit{RTCFake} dataset is provided in the {https://huggingface.co/datasets/JunXueTech/RTCFake}."
