arxiv_id,title,authors,submitted,categories,url,abstract
2603.29162,From Natural Alignment to Conditional Controllability in Multimodal Dialogue,"Zeyu Jin, Songtao Zhou, Haoyu Wang, Minghao Tian, Kaifeng Yun, Zhuo Chen, Xiaoyu Qin, Jia Jia",2026-03-31,cs.MM,https://arxiv.org/abs/2603.29162,"The recent advancement of Artificial Intelligence Generated Content (AIGC) has led to significant strides in modeling human interaction, particularly in the context of multimodal dialogue. While current methods impressively generate realistic dialogue in isolated modalities like speech or vision, challenges remain in controllable Multimodal Dialogue Generation (MDG). This paper focuses on the natural alignment between speech, vision, and text in human interaction, aiming for expressive dialogue generation through multimodal conditional control. To address the insufficient richness and diversity of dialogue expressiveness in existing datasets, we introduce a novel multimodal dialogue annotation pipeline to curate dialogues from movies and TV series with fine-grained annotations in interactional characteristics. The resulting MM-Dia dataset (360+ hours, 54,700 dialogues) facilitates explicitly controlled MDG, specifically through style-controllable dialogue speech synthesis. In parallel, MM-Dia-Bench (309 highly expressive dialogues with visible single-/dual-speaker scenes) serves as a rigorous testbed for implicit cross-modal MDG control, evaluating audio-visual style consistency across modalities. Extensive experiments demonstrate that training on MM-Dia significantly enhances fine-grained controllability, while evaluations on MM-Dia-Bench reveal limitations in current frameworks to replicate the nuanced expressiveness of human interaction. These findings provides new insights and challenges for multimodal conditional dialogue generation."
2604.02374,Evaluating Generalization and Robustness in Russian Anti-Spoofing: The RuASD Initiative,"Ksenia Lysikova, Kirill Borodin, Kirill Borodin",2026-03-31,cs.SD,https://arxiv.org/abs/2604.02374,"RuASD (Russian AntiSpoofing Dataset) is a dedicated, reproducible benchmark for Russian-language speech anti-spoofing designed to evaluate both in-domain discrimination and robustness to deployment-style distribution shifts. It combines a large spoof subset synthesized using 37 modern Russian-capable TTS and voice-cloning systems with a bona fide subset curated from multiple heterogeneous open Russian speech corpora, enabling systematic evaluation across diverse data sources. To emulate typical dissemination and channel effects in a controlled and reproducible manner, RuASD includes configurable simulations of platform and transmission distortions, including room reverberation, additive noise/music, and a range of speech-codec transcodings implemented via a unified processing chain. We benchmark a diverse set of publicly available anti-spoofing countermeasures spanning lightweight supervised architectures, graph-attention models, SSL-based detectors, and large-scale pretrained systems, and report reference results on both clean and simulated conditions to characterize robustness under realistic perturbation pipelines. The dataset is publickly available at \href{https://huggingface.co/datasets/MTUCI/RuASD}{\underline{Hugging Face}} and \href{https://modelscope.cn/datasets/lab260/RuASD}{\underline{ModelScope}}."
2603.28086,MOSS-VoiceGenerator: Create Realistic Voices with Natural Language Descriptions,"Kexin Huang, Liwei Fan, Botian Jiang, Yaozhou Jiang, Qian Tu, Jie Zhu, Yuqian Zhang, Yiwei Zhao, Chenchen Yang, Zhaoye Fei, Shimin Li, Xiaogui Yang, Qinyuan Cheng, Xipeng Qiu",2026-03-30,cs.SD cs.AI cs.CL,https://arxiv.org/abs/2603.28086,"Voice design from natural language aims to generate speaker timbres directly from free-form textual descriptions, allowing users to create voices tailored to specific roles, personalities, and emotions. Such controllable voice creation benefits a wide range of downstream applications-including storytelling, game dubbing, role-play agents, and conversational assistants, making it a significant task for modern Text-to-Speech models. However, existing models are largely trained on carefully recorded studio data, which produces speech that is clean and well-articulated, yet lacks the lived-in qualities of real human voices. To address these limitations, we present MOSS-VoiceGenerator, an open-source instruction-driven voice generation model that creates new timbres directly from natural language prompts. Motivated by the hypothesis that exposure to real-world acoustic variation produces more perceptually natural voices, we train on large-scale expressive speech data sourced from cinematic content. Subjective preference studies demonstrate its superiority in overall performance, instruction-following, and naturalness compared to other voice design models."
2603.28554,Hydra: Unifying Document Retrieval and Generation in a Single Vision-Language Model,Athos Georgiou,2026-03-30,cs.CV cs.AI cs.IR,https://arxiv.org/abs/2603.28554,"Visual document understanding typically requires separate retrieval and generation models, doubling memory and system complexity. We present Hydra, a dual-head approach that provides both ColBERT-style late-interaction retrieval and autoregressive generation from a single vision-language model (VLM). A single LoRA adapter, trained only for retrieval, is toggled at inference: enabling it produces multi-vector embeddings; disabling it recovers the base model's generation quality -- byte-identical outputs in 100% of 10,500 greedy and stochastic samples, with max delta-ANLS = 0.0044 across 15,301 samples on four VQA benchmarks (three informative; ChartQA is near-zero for both models under greedy decoding) when compared against an independent base-model pipeline. We identify three engineering requirements (attention-mode restoration, lm_head preservation, KV-cache-aware decoding) whose omission silently breaks generation despite correct weight recovery. On ViDoRe V1, Hydra (4B) is within 1 percentage point of a controlled single-head baseline in a single training run, with higher aggregate scores on V2 and V3 that are concentrated on a subset of tasks; multi-seed experiments are needed to confirm these trends. The single-model design reduces peak GPU memory by 41%, though adapter switching introduces throughput overhead under concurrent serving loads. An ablation shows that GritLM-style joint training provides no benefit within the LoRA-based (r=16) training regime. A proof-of-concept extension to Qwen2.5-Omni-3B demonstrates that the mechanism generalizes to audio retrieval and video embedding, with speech generation."
2603.27562,VoxAnchor: Grounding Speech Authenticity in Throat Vibration via mmWave Radar,"Mingda Han, Huanqi Yang, Chaoqun Li, Wenhao Li, Guoming Zhang, Yanni Yang, Yetong Cao, Weitao Xu, Pengfei Hu",2026-03-29,cs.HC,https://arxiv.org/abs/2603.27562,"Rapid advances in speech synthesis and audio editing have made realistic forgeries increasingly accessible, yet existing detection methods remain vulnerable to tampering or depend on visual/wearable sensors. In this paper, we present VoxAnchor, a system that physically grounds audio authentication in vocal dynamics by leveraging the inherent coherence between speech acoustics and radar-sensed throat vibrations. VoxAnchor uses contactless millimeter-wave radar to capture fine-grained throat vibrations that are tightly coupled with human speech production, establishing a hard-to-forge anchor rooted in human physiology. The design comprises three main components: (1) a cross-modal frame-work that uses modality-specific encoders and contrastive learning to detect subtle mismatches at word granularity; (2) a phase-aware pipeline that extracts physically consistent, temporally faithful throat vibrations; and (3) a dual-stage strategy that combines signal-level onset detection and semantic-level coherence to align asynchronous radar and audio streams. Unlike liveness detection, which only confirms whether speech occurred, VoxAnchor verifies what was spoken through word-level content consistency, exposing localized edits that preserve identity and global authenticity cues. Extensive evaluations show that VoxAnchor achieves robust, fine-grained detection across diverse forgeries (editing, splicing, replay, deepfake) and conditions, with an overall EER of 0.017, low latency, and modest computational cost."
2603.25551,Voxtral TTS,"Alexander H. Liu, Alexis Tacnet, Andy Ehrenberg, Andy Lo, Chen-Yo Sun, Guillaume Lample, Henry Lagarde, Jean-Malo Delignon, Jaeyoung Kim, John Harvill, Khyathi Raghavi Chandu, Lorenzo Signoretti, Margaret Jennings, Patrick von Platen, Pavankumar Reddy Muddireddy, Rohin Arora, Sanchit Gandhi, Samuel Humeau, Soham Ghosh, Srijan Mishra, Van Phung, Abdelaziz Bounhar, Abhinav Rastogi, Adrien Sadé, Alan Jeffares, Albert Jiang, Alexandre Cahill, Alexandre Gavaudan, Alexandre Sablayrolles, Amélie Héliou, Amos You, Andrew Bai, Andrew Zhao, Angele Lenglemetz, Anmol Agarwal, Anton Eliseev, Antonia Calvi, Arjun Majumdar, Arthur Fournier, Artjom Joosen, Avi Sooriyarachchi, Aysenur Karaduman Utkur, Baptiste Bout, Baptiste Rozière, Baudouin De Monicault, Benjamin Tibi, Bowen Yang, Charlotte Cronjäger, Clémence Lanfranchi, Connor Chen, Corentin Barreau, Corentin Sautier, Cyprien Courtot, Darius Dabert, Diego de las Casas, Elizaveta Demyanenko, Elliot Chane-Sane, Emmanuel Gottlob, Enguerrand Paquin, Etienne Goffinet, Fabien Niel, Faruk Ahmed, Federico Baldassarre, Gabrielle Berrada, Gaëtan Ecrepont, Gauthier Guinet, Genevieve Hayes, Georgii Novikov, Giada Pistilli, Guillaume Kunsch, Guillaume Martin, Guillaume Raille, Gunjan Dhanuka, Gunshi Gupta, Han Zhou, Harshil Shah, Hope McGovern, Hugo Thimonier, Indraneel Mukherjee, Irene Zhang, Jacques Sun, Jan Ludziejewski, Jason Rute, Jérémie Dentan, Joachim Studnia, Jonas Amar, Joséphine Delas, Josselin Somerville Roberts, Julien Tauran, Karmesh Yadav, Kartik Khandelwal, Kilian Tep, Kush Jain, Laurence Aitchison, Laurent Fainsin, Léonard Blier, Lingxiao Zhao, Louis Martin, Lucile Saulnier, Luyu Gao, Maarten Buyl, Manan Sharma, Marie Pellat, Mark Prins, Martin Alexandre, Mathieu Poirée, Mathieu Schmitt, Mathilde Guillaumin, Matthieu Dinot, Matthieu Futeral, Maxime Darrin, Maximilian Augustin, Mert Unsal, Mia Chiquier, Mikhail Biriuchinskii, Minh-Quang Pham, Mircea Lica, Morgane Rivière, Nathan Grinsztajn, Neha Gupta, Olivier Bousquet, Olivier Duchenne, Patricia Wang, Paul Jacob, Paul Wambergue, Paula Kurylowicz, Philippe Pinel, Philomène Chagniot, Pierre Stock, Piotr Miłoś, Prateek Gupta, Pravesh Agrawal, Quentin Torroba, Ram Ramrakhya, Randall Isenhour, Rishi Shah, Romain Sauvestre, Roman Soletskyi, Rosalie Millner, Rupert Menneer, Sagar Vaze, Samuel Barry, Samuel Belkadi, Sandeep Subramanian, Sean Cha, Shashwat Verma, Siddhant Waghjale, Siddharth Gandhi, Simon Lepage, Sumukh Aithal, Szymon Antoniak, Tarun Kumar Vangani, Teven Le Scao, Théo Cachet, Theo Simon Sorg, Thibaut Lavril, Thomas Chabal, Thomas Foubert, Thomas Robert, Thomas Wang, Tim Lawson, Tom Bewley, Tom Edwards, Tyler Wang, Umar Jamil, Umberto Tomasini, Valeriia Nemychnikova, Vedant Nanda, Victor Jouault, Vincent Maladière, Vincent Pfister, Virgile Richard, Vladislav Bataev, Wassim Bouaziz, Wen-Ding Li, William Havard, William Marshall, Xinghui Li, Xingran Guo, Xinyu Yang, Yannic Neuhaus, Yassine El Ouahidi, Yassir Bendou, Yihan Wang, Yimu Pan, Zaccharie Ramzi, Zhenlin Xu",2026-03-26,cs.AI,https://arxiv.org/abs/2603.25551,"We introduce Voxtral TTS, an expressive multilingual text-to-speech model that generates natural speech from as little as 3 seconds of reference audio. Voxtral TTS adopts a hybrid architecture that combines auto-regressive generation of semantic speech tokens with flow-matching for acoustic tokens. These tokens are encoded and decoded with Voxtral Codec, a speech tokenizer trained from scratch with a hybrid VQ-FSQ quantization scheme. In human evaluations conducted by native speakers, Voxtral TTS is preferred for multilingual voice cloning due to its naturalness and expressivity, achieving a 68.4\% win rate over ElevenLabs Flash v2.5. We release the model weights under a CC BY-NC license."
2603.23938,OmniACBench: A Benchmark for Evaluating Context-Grounded Acoustic Control in Omni-Modal Models,"Seunghee Kim, Bumkyu Park, Kyudan Jung, Joosung Lee, Soyoon Kim, Jeonghoon Kim, Taeuk Kim, Hwiyeol Jo",2026-03-25,cs.CL,https://arxiv.org/abs/2603.23938,"Most testbeds for omni-modal models assess multimodal understanding via textual outputs, leaving it unclear whether these models can properly speak their answers. To study this, we introduce OmniACBench, a benchmark for evaluating context-grounded acoustic control in omni-modal models. Given a spoken instruction, a text script, and an image, a model must read the script aloud with an appropriate tone and manner. OmniACBench comprises 3,559 verified instances covering six acoustic features: speech rate, phonation, pronunciation, emotion, global accent, and timbre. Extensive experiments on eight models reveal their limitations in the proposed setting, despite their strong performance on prior textual-output evaluations. Our analyses show that the main bottleneck lies not in processing individual modalities, but in integrating multimodal context for faithful speech generation. Moreover, we identify three common failure modes-weak direct control, failed implicit inference, and failed multimodal grounding-providing insights for developing models that can verbalize responses effectively."
2603.19831,Gesture2Speech: How Far Can Hand Movements Shape Expressive Speech?,"Lokesh Kumar, Nirmesh Shah, Ashishkumar P. Gudmalwar, Pankaj Wasnik",2026-03-20,eess.AS cs.AI cs.MM,https://arxiv.org/abs/2603.19831,"Human communication seamlessly integrates speech and bodily motion, where hand gestures naturally complement vocal prosody to express intent, emotion, and emphasis. While recent text-to-speech (TTS) systems have begun incorporating multimodal cues such as facial expressions or lip movements, the role of hand gestures in shaping prosody remains largely underexplored. We propose a novel multimodal TTS framework, Gesture2Speech, that leverages visual gesture cues to modulate prosody in synthesized speech. Motivated by the observation that confident and expressive speakers coordinate gestures with vocal prosody, we introduce a multimodal Mixture-of-Experts (MoE) architecture that dynamically fuses linguistic content and gesture features within a dedicated style extraction module. The fused representation conditions an LLM-based speech decoder, enabling prosodic modulation that is temporally aligned with hand movements. We further design a gesture-speech alignment loss that explicitly models their temporal correspondence to ensure fine-grained synchrony between gestures and prosodic contours. Evaluations on the PATS dataset show that Gesture2Speech outperforms state-of-the-art baselines in both speech naturalness and gesture-speech synchrony. To the best of our knowledge, this is the first work to utilize hand gesture cues for prosody control in neural speech synthesis. Demo samples are available at https://research.sri-media-analysis.com/aaai26-beeu-gesture2speech/"
2603.19798,Borderless Long Speech Synthesis,"Xingchen Song, Di Wu, Dinghao Zhou, Pengyu Cheng, Hongwu Ding, Yunchao He, Jie Wang, Shengfan Shen, Sixiang Lv, Lichun Fan, Hang Su, Yifeng Wang, Shuai Wang, Meng Meng, Jian Luan",2026-03-20,cs.SD cs.CL eess.AS,https://arxiv.org/abs/2603.19798,"Most existing text-to-speech (TTS) systems either synthesize speech sentence by sentence and stitch the results together, or drive synthesis from plain-text dialogues alone. Both approaches leave models with little understanding of global context or paralinguistic cues, making it hard to capture real-world phenomena such as multi-speaker interactions (interruptions, overlapping speech), evolving emotional arcs, and varied acoustic environments. We introduce the Borderless Long Speech Synthesis framework for agent-centric, borderless long audio synthesis. Rather than targeting a single narrow task, the system is designed as a unified capability set spanning VoiceDesigner, multi-speaker synthesis, Instruct TTS, and long-form text synthesis. On the data side, we propose a ""Labeling over filtering/cleaning"" strategy and design a top-down, multi-level annotation schema we call Global-Sentence-Token. On the model side, we adopt a backbone with a continuous tokenizer and add Chain-of-Thought (CoT) reasoning together with Dimension Dropout, both of which markedly improve instruction following under complex conditions. We further show that the system is Native Agentic by design: the hierarchical annotation doubles as a Structured Semantic Interface between the LLM Agent and the synthesis engine, creating a layered control protocol stack that spans from scene semantics down to phonetic detail. Text thereby becomes an information-complete, wide-band control channel, enabling a front-end LLM to convert inputs of any modality into structured generation commands, extending the paradigm from Text2Speech to borderless long speech synthesis."
2603.19739,MOSS-TTSD: Text to Spoken Dialogue Generation,"Yuqian Zhang, Donghua Yu, Zhengyuan Lin, Botian Jiang, Mingshu Chen, Yaozhou Jiang, Yiwei Zhao, Yiyang Zhang, Yucheng Yuan, Hanfu Chen, Kexin Huang, Jun Zhan, Cheng Chang, Zhaoye Fei, Shimin Li, Xiaogui Yang, Qinyuan Cheng, Xipeng Qiu",2026-03-20,cs.SD cs.AI cs.CL,https://arxiv.org/abs/2603.19739,"Spoken dialogue generation is crucial for applications like podcasts, dynamic commentary, and entertainment content, but poses significant challenges compared to single-utterance text-to-speech (TTS). Key requirements include accurate turn-taking, cross-turn acoustic consistency, and long-form stability, which current models often fail to address due to a lack of dialogue context modeling. To bridge this gap, we present MOSS-TTSD, a spoken dialogue synthesis model designed for expressive, multi-party conversational speech across multiple languages. With enhanced long-context modeling, MOSS-TTSD generates long-form spoken conversations from dialogue scripts with explicit speaker tags, supporting up to 60 minutes of single-pass synthesis, multi-party dialogue with up to 5 speakers, and zero-shot voice cloning from a short reference audio clip. The model supports various mainstream languages, including English and Chinese, and is adapted to several long-form scenarios. Additionally, to address limitations of existing evaluation methods, we propose TTSD-eval, an objective evaluation framework based on forced alignment that measures speaker attribution accuracy and speaker similarity without relying on speaker diarization tools. Both objective and subjective evaluation results show that MOSS-TTSD surpasses strong open-source and proprietary baselines in dialogue synthesis."
2603.18090,MOSS-TTS Technical Report,"Yitian Gong, Botian Jiang, Yiwei Zhao, Yucheng Yuan, Kuangwei Chen, Yaozhou Jiang, Cheng Chang, Dong Hong, Mingshu Chen, Ruixiao Li, Yiyang Zhang, Yang Gao, Hanfu Chen, Ke Chen, Songlin Wang, Xiaogui Yang, Yuqian Zhang, Kexin Huang, ZhengYuan Lin, Kang Yu, Ziqi Chen, Jin Wang, Zhaoye Fei, Qinyuan Cheng, Shimin Li, Xipeng Qiu",2026-03-18,cs.SD cs.AI cs.CL,https://arxiv.org/abs/2603.18090,"This technical report presents MOSS-TTS, a speech generation foundation model built on a scalable recipe: discrete audio tokens, autoregressive modeling, and large-scale pretraining. Built on MOSS-Audio-Tokenizer, a causal Transformer tokenizer that compresses 24 kHz audio to 12.5 fps with variable-bitrate RVQ and unified semantic-acoustic representations, we release two complementary generators: MOSS-TTS, which emphasizes structural simplicity, scalability, and long-context/control-oriented deployment, and MOSS-TTS-Local-Transformer, which introduces a frame-local autoregressive module for higher modeling efficiency, stronger speaker preservation, and a shorter time to first audio. Across multilingual and open-domain settings, MOSS-TTS supports zero-shot voice cloning, token-level duration control, phoneme-/pinyin-level pronunciation control, smooth code-switching, and stable long-form generation. This report summarizes the design, training recipe, and empirical characteristics of the released models."
2603.17231,Neuron-Level Emotion Control in Speech-Generative Large Audio-Language Models,"Xiutian Zhao, Ismail Rasim Ulgen, Philipp Koehn, Björn Schuller, Berrak Sisman",2026-03-18,cs.CL eess.AS,https://arxiv.org/abs/2603.17231,"Large audio-language models (LALMs) can produce expressive speech, yet reliable emotion control remains elusive: conversions often miss the target affect and may degrade linguistic fidelity through refusals, hallucinations, or paraphrase. We present, to our knowledge, the first neuron-level study of emotion control in speech-generative LALMs and demonstrate that compact emotion-sensitive neurons (ESNs) are causally actionable, enabling training-free emotion steering at inference time. ESNs are identified via success-filtered activation aggregation enforcing both emotion realization and content preservation. Across three LALMs (Qwen2.5-Omni-7B, MiniCPM-o 4.5, Kimi-Audio), ESN interventions yield emotion-specific gains that generalize to unseen speakers and are supported by automatic and human evaluation. Controllability depends on selector design, mask sparsity, filtering, and intervention strength. Our results establish a mechanistic framework for training-free emotion control in speech generation."
2603.16606,Omnilingual SONAR: Cross-Lingual and Cross-Modal Sentence Embeddings Bridging Massively Multilingual Text and Speech,"Omnilingual SONAR Team, João Maria Janeiro, Pere-Lluís Huguet Cabot, Ioannis Tsiamas, Yen Meng, Vivek Iyer, Guillem Ramírez, Loic Barrault, Belen Alastruey, Yu-An Chung, Marta R. Costa-Jussa, David Dale, Kevin Heffernan, Jaehyeong Jo, Artyom Kozhevnikov, Alexandre Mourachko, Christophe Ropers, Holger Schwenk, Paul-Ambroise Duquenne",2026-03-17,cs.CL,https://arxiv.org/abs/2603.16606,"Cross-lingual sentence encoders typically cover only a few hundred languages and often trade downstream quality for stronger alignment, limiting their adoption. We introduce OmniSONAR, a new family of omnilingual, cross-lingual and cross-modal sentence embedding models that natively embed text, speech, code, and mathematical expressions in a single semantic space, while delivering state-of-the-art downstream performance at the scale of thousands of languages, from high-resource to extremely low-resource varieties. To reach this scale without representation collapse, we use progressive training. We first learn a strong foundational space for 200 languages with an LLM-initialized encoder-decoder, combining token-level decoding with a novel split-softmax contrastive loss and synthetic hard negatives. Building on this foundation, we expand to several thousands language varieties via a two-stage teacher-student encoder distillation framework. Finally, we demonstrate the cross-modal extensibility of this space by seamlessly mapping 177 spoken languages into it. OmniSONAR halves cross-lingual similarity search error on the 200-language FLORES dataset and reduces error by a factor of 15 on the 1,560-language BIBLE benchmark. It also enables strong translation, outperforming NLLB-3B on multilingual benchmarks and exceeding prior models (including much larger LLMs) by 15 chrF++ points on 1,560 languages into English BIBLE translation. OmniSONAR also performs strongly on MTEB and XLCoST. For speech, OmniSONAR achieves a 43% lower similarity-search error and reaches 97% of SeamlessM4T speech-to-text quality, despite being zero-shot for translation (trained only on ASR data). Finally, by training an encoder-decoder LM, Spectrum, exclusively on English text processing OmniSONAR embedding sequences, we unlock high-performance transfer to thousands of languages and speech for complex downstream tasks."
2603.16280,CAST-TTS: A Simple Cross-Attention Framework for Unified Timbre Control in TTS,"Zihao Zheng, Wen Wu, Chao Zhang, Mengyue Wu, Xuenan Xu",2026-03-17,cs.SD eess.AS,https://arxiv.org/abs/2603.16280,"Current Text-to-Speech (TTS) systems typically use separate models for speech-prompted and text-prompted timbre control. While unifying both control signals into a single model is desirable, the challenge of cross-modal alignment often results in overly complex architectures and training objective. To address this challenge, we propose CAST-TTS, a simple yet effective framework for unified timbre control. Features are extracted from speech prompts and text prompts using pre-trained encoders. The multi-stage training strategy efficiently aligns the speech and projected text representations within a shared embedding space. A single cross-attention mechanism then allows the model to use either of these representations to control the timbre. Extensive experiments validate that the unified cross-attention mechanism is critical for achieving high-quality synthesis. CAST-TTS achieves performance comparable to specialized single-input models while operating within a unified architecture. The demo page can be accessed at https://HiRookie9.github.io/CAST-TTS-Page."
